insomnia_ukb,Insomnia,sleep / brain-direct,Cluster85,85,DLNP_85,Deep-layer near-projecting,NEUR,VGLUT1 VGLUT2 VGLUT3,"Cerebral cortex: 47.1%, Basal forebrain: 37.0%, Hypothalamus: 10.9%","Human ACC: 32.3%, Human SEP: 25.9%, Human SI: 9.7%","AC005909.2, FER1L6-AS2, PRELP, AC093912.1, NPSR1-AS1, VWA2, LPIN3, ABCC9, CDCP1, MROH2A",16327,7.6333,0.012734,4.5874,0.048069,1.3181349125915378,False,136,,,85,514.0
insomnia_ukb,Insomnia,sleep / brain-direct,Cluster440,440,Midi_440,Midbrain-derived inhibitory,NEUR,GABA,"Thalamus: 87.1%, Midbrain: 10.2%, Pons: 1.9%","Human ETH: 15.2%, Human Pul: 11.7%, Human MD: 10.5%","AC008163.1, OTX2-AS1, DMBX1, AL161757.4, OTX2, AL137100.3, LINC01210, CASR, GATA3, SOX14",16327,8.6589,0.013418,5.2054,0.048125,1.317629257483443,False,137,,,440,7366.0
insomnia_ukb,Insomnia,sleep / brain-direct,Cluster159,159,Amex_159,Amygdala excitatory,NEUR,VGLUT1 VGLUT2,"Amygdala: 80.8%, Cerebral cortex: 17.6%, Hippocampus: 1.3%","Human CMN: 32.2%, Human BM: 26.7%, Human CEN: 17.3%","POSTN, AC018742.1, LINC02653, AL583785.1, DCSTAMP, PWWP3B, NPFFR2, AL139340.1, KCNG1, AC068633.1",16327,8.4452,0.012776,5.1075,0.049128,1.3086709156258882,False,138,,,159,2148.0
insomnia_ukb,Insomnia,sleep / brain-direct,Cluster455,455,Thex_455,Thalamic excitatory,NEUR,VGLUT2,"Thalamus: 97.9%, Midbrain: 2.1%, Cerebral cortex: 0.0%","Human Pul: 40.5%, Human ETH: 38.2%, Human MD: 5.5%","AC037486.1, LINC01151, SMILR, MATN3, FSHR, COL6A5, CYP27C1, CLEC3A, ITIH5, AC012535.1",16327,6.179,0.01226,3.759,0.050122,1.2999716078368246,False,139,,,455,474.0
insomnia_ukb,Insomnia,sleep / brain-direct,Cluster268,268,LLC_268,LAMP5-LHX6 and Chandelier,NEUR,GABA,"Hippocampus: 95.5%, Cerebral cortex: 2.4%, Amygdala: 1.1%","Human CA1U-CA2U-CA3U: 17.8%, Human CA3R: 17.6%, Human CA4C-DGC: 13.9%","CHRDL1, AL136456.1, EYA4, HAPLN1, LINC01344, CHST9, ANO1, TACR1, GRPR, NPPC",16327,8.8755,0.013157,5.427,0.050989,1.2925235053641715,False,140,,,268,3843.0
insomnia_ukb,Insomnia,sleep / brain-direct,Cluster360,360,Splat_360,Splatter,NEUR,GABA,"Midbrain: 99.1%, Pons: 0.8%, Thalamus: 0.1%","Human SC: 87.1%, Human IC: 10.6%, Human PTR: 0.6%","IGFL1, AP000146.1, LINC01692, OTX2, GATA3, IRX2, DMBX1, COL6A2, IRX3, FST",16327,7.849,0.012948,4.8072,0.051274,1.2901028009491995,False,141,,,360,1215.0
insomnia_ukb,Insomnia,sleep / brain-direct,Cluster428,428,Splat_428,Splatter,NEUR,GABA,"Basal forebrain: 59.7%, Amygdala: 16.1%, Hypothalamus: 13.8%","Human SEP: 55.1%, Human BNST: 12.4%, Human ANC: 5.7%","FREM2, AC092958.2, SCGN, AC092957.1, ZIC2, LHX8, PRDM12, PRDM16, ZIC5, TTR",16327,10.243,0.013118,6.2739,0.051284,1.2900181084857583,False,142,,,428,3182.0
insomnia_ukb,Insomnia,sleep / brain-direct,Cluster280,280,CGE_280,CGE interneuron,NEUR,GABA,"Cerebral cortex: 73.7%, Amygdala: 13.3%, Hippocampus: 7.8%","Human MEC: 7.2%, Human Pir: 6.0%, Human LEC: 5.6%","AC006305.1, LINC01416, AL391832.4, LINC01905, SP8, DCN, CHRNB3, CXCL14, CHRNA7, CRH",16327,8.1734,0.012853,5.0068,0.051304,1.2898487730908172,False,143,,,280,5106.0
insomnia_ukb,Insomnia,sleep / brain-direct,Cluster350,350,Splat_350,Splatter,NEUR,GLY,"Medulla: 98.2%, Spinal cord: 1.0%, Pons: 0.7%","Human MoRF-MoEN: 48.6%, Human MoAN: 35.1%, Human MoSR: 14.5%","SLC6A5, HOXB3, SKOR2, TFAP2A, LBX1-AS1, CRABP1, HOXA3, MAB21L2, HOXB2, HOXD3",16327,7.7707,0.013013,4.7671,0.051555,1.2877292088070935,False,144,,,350,3486.0
insomnia_ukb,Insomnia,sleep / brain-direct,Cluster423,423,Splat_423,Splatter,NEUR,GABA,"Amygdala: 50.6%, Thalamus: 19.8%, Hypothalamus: 15.4%","Human ANC: 19.2%, Human CEN: 17.4%, Human CMN: 13.8%","CYP19A1, SCN5A, DGKK, GABRQ, ARHGAP36, DIRAS3, NTS, FBXL21P, AL035425.2, VWA5B1",16327,11.25,0.012501,6.9424,0.052579,1.279187677997853,False,145,,,423,3114.0
insomnia_ukb,Insomnia,sleep / brain-direct,Cluster130,130,ULIT_130,Upper-layer intratelencephalic,NEUR,VGLUT1 VGLUT2,"Cerebral cortex: 97.8%, Amygdala: 0.7%, Basal forebrain: 0.7%","Human A29-A30: 18.1%, Human MTG: 12.0%, Human A23: 7.7%","AC008568.1, AC025839.1, LINC02296, AJ009632.2, SLC38A11, AL117329.1, ENPEP, MIR3976HG, AC016598.2, MFGE8",16327,9.5484,0.012693,5.8976,0.052731,1.2779339925531583,False,146,,,130,25496.0
insomnia_ukb,Insomnia,sleep / brain-direct,Cluster201,201,DG_201,Hippocampal dentate gyrus,NEUR,VGLUT1,"Hippocampus: 99.9%, Midbrain: 0.1%, Thalamus: 0.0%","Human DGU-CA4Upy: 34.3%, Human DGR-CA4: 34.3%, Human DGR-CA4Rpy: 14.6%","AC097487.1, AC097528.1, COL6A3, NTF3, LINC01697, ANKRD20A19P, AL672167.1, LINC01324, AC092110.1, AL445985.1",16327,8.3704,0.012814,5.1743,0.052877,1.276733192713128,False,147,,,201,18996.0
insomnia_ukb,Insomnia,sleep / brain-direct,Cluster347,347,Splat_347,Splatter,NEUR,GLY,"Medulla: 68.6%, Spinal cord: 29.3%, Pons: 0.9%","Human MoAN: 33.4%, Human SpC: 29.3%, Human MoSR: 21.6%","PAX2, HOXB3, EBF3, NPPC, SLC6A5, HOXB7, AC024230.1, HOXB-AS3, PAX8, PDYN",16327,6.6983,0.013345,4.1482,0.053196,1.2741210226530406,False,148,,,347,2434.0
insomnia_ukb,Insomnia,sleep / brain-direct,Cluster417,417,Splat_417,Splatter,NEUR,GABA HDC,"Hypothalamus: 95.8%, Midbrain: 4.0%, Amygdala: 0.1%","Human HTHtub: 32.3%, Human HTHso-HTHtub: 31.4%, Human HTHma-HTHtub: 26.7%","GHRH, OTP, CALCR, ECEL1, DLK1, C14orf39, ISL1, GAL, GABRE, SIX6",16327,7.8674,0.012456,4.9121,0.05463,1.2625687994854176,False,149,,,417,3885.0
insomnia_ukb,Insomnia,sleep / brain-direct,Cluster307,307,CBI_307,Cerebellar inhibitory,NEUR,GABA,"Cerebellum: 70.3%, Medulla: 12.1%, Pons: 11.7%","Human CBV: 58.9%, Human CBL: 10.0%, Human PnEN: 5.7%","SCGN, TFAP2B, LINC00492, TFAP2A, TPTE2P4, CLCNKA, LIPG, LRRC38, LINC02552, LBX1-AS1",16327,6.2338,0.012628,3.9422,0.056917,1.2447579989212303,False,150,,,307,3020.0
insomnia_ukb,Insomnia,sleep / brain-direct,Cluster438,438,Midi_438,Midbrain-derived inhibitory,NEUR,GABA,"Midbrain: 44.9%, Thalamus: 38.0%, Hypothalamus: 8.8%","Human SN-RN: 11.6%, Human CM-Pf: 8.9%, Human PAG: 7.1%","AC008163.1, AL161757.4, LINC01210, OTX2, OTX2-AS1, DMBX1, CASR, AL137100.3, SOX14, GATA3",16327,7.5304,0.012635,4.8062,0.058591,1.2321690896221857,False,151,,,438,11928.0
insomnia_ukb,Insomnia,sleep / brain-direct,Cluster435,435,Midi_435,Midbrain-derived inhibitory,NEUR,GABA,"Midbrain: 54.9%, Thalamus: 43.2%, Pons: 0.8%","Human SN-RN: 24.2%, Human CM-Pf: 13.1%, Human PAG: 7.4%","NPSR1, LINC01210, CASR, SOX14, OTX2, OTX2-AS1, AC007159.1, DMBX1, GATA3, AL161757.4",16327,5.4613,0.012227,3.5042,0.059571,1.2249651094724714,False,152,,,435,7340.0
insomnia_ukb,Insomnia,sleep / brain-direct,Cluster409,409,Splat_409,Splatter,NEUR,GABA,"Basal forebrain: 66.5%, Amygdala: 14.2%, Thalamus: 9.9%","Human CaB: 17.8%, Human SI: 13.0%, Human NAC: 11.5%","GLP1R, CRABP1, CER1, TAC3, AL096799.1, TRH, LINC02203, NANOS1, NPR3, CHRNA3",16327,4.4578,0.012282,2.8617,0.059658,1.2243313102016316,False,153,,,409,6395.0
insomnia_ukb,Insomnia,sleep / brain-direct,Cluster309,309,URL_309,Upper rhombic lip,NEUR,VGLUT1 VGLUT2,"Pons: 89.0%, Cerebellum: 8.6%, Medulla: 1.6%","Human PnEN: 37.8%, Human PnAN: 28.2%, Human PB: 12.3%","AC017037.5, AC108517.2, AC084740.1, LMX1A, ABCA13, AC092957.1, TMEM255B, CBLN1, CPLX4, AC080079.2",16327,6.1194,0.012338,3.9927,0.062691,1.2027948025646444,False,154,,,309,373.0
insomnia_ukb,Insomnia,sleep / brain-direct,Cluster167,167,Misc_167,Miscellaneous,NEUR,VGLUT1,"Hippocampus: 76.8%, Cerebral cortex: 14.3%, Midbrain: 8.2%","Human Sub: 29.3%, Human CA1U-CA2U-CA3U: 25.4%, Human CA1-2R: 15.9%","LINC01524, ANO2, AL109930.1, FRMD6-AS2, AL391097.3, AL031674.1, TRPC6, RASSF9, AL391097.1, SEMA3D",16327,7.1975,0.011713,4.6972,0.062738,1.2024693301203961,False,155,,,167,1973.0
insomnia_ukb,Insomnia,sleep / brain-direct,Cluster125,125,ULIT_125,Upper-layer intratelencephalic,NEUR,VGLUT1 VGLUT2,"Cerebral cortex: 98.3%, Basal forebrain: 0.9%, Amygdala: 0.4%","Human MTG: 12.0%, Human V2: 10.3%, Human A5-A7: 9.0%","LINC02306, AC110614.1, LINC00507, LINC00326, AC097512.1, LINC00508, AC092440.1, AL132633.1, CYP1B1, AC093607.1",16327,8.6459,0.012001,5.6557,0.063182,1.199406630801616,False,156,,,125,13397.0
insomnia_ukb,Insomnia,sleep / brain-direct,Cluster356,356,Splat_356,Splatter,NEUR,GABA,"Midbrain: 67.5%, Pons: 20.1%, Thalamus: 9.5%","Human PTR: 30.3%, Human IC: 11.1%, Human SC: 8.1%","MECOM, COL8A1, GATA3, LHX5-AS1, AC005100.1, GATA3-AS1, LMO1, EBF3, GATA2, TFAP2A",16327,9.1178,0.011829,5.9654,0.063211,1.1992073390655833,False,157,,,356,6063.0
insomnia_ukb,Insomnia,sleep / brain-direct,Cluster86,86,DLNP_86,Deep-layer near-projecting,NEUR,VGLUT1 VGLUT2,"Cerebral cortex: 97.0%, Basal forebrain: 1.8%, Hippocampus: 1.1%","Human M1C: 30.8%, Human S1C: 8.6%, Human Ig: 6.4%","IFNG-AS1, NPSR1-AS1, IL26, ROBO3, AC087863.2, LINC02444, SLC9C1, LINC02218, NPSR1, LINC01479",16327,7.165,0.011908,4.7618,0.066214,1.1790501755161311,False,158,,,86,1508.0
insomnia_ukb,Insomnia,sleep / brain-direct,Cluster252,252,MGE_252,MGE interneuron,NEUR,GABA VGLUT3,"Cerebral cortex: 85.8%, Hippocampus: 8.0%, Basal forebrain: 3.6%","Human M1C: 11.7%, Human MTG: 6.1%, Human S1C: 4.3%","EDNRA, AL450345.2, NMU, SST, PAWR, TAC3, DCN, PNOC, CYP26A1, ITGA1",16327,8.0556,0.01187,5.3987,0.067843,1.1684949559365032,False,159,,,252,16079.0
insomnia_ukb,Insomnia,sleep / brain-direct,Cluster324,324,Mmb_324,Mammillary body,NEUR,VGLUT2,"Hypothalamus: 100.0%, Cerebral cortex: 0.0%, Amygdala: 0.0%","Human MN: 52.3%, Human HTHma-HTHtub: 34.2%, Human HTHma: 13.5%","LINC00410, AC244258.1, PITX2, FOXB1, TNFRSF11B, AL691420.1, LHX1-DT, LHX1, DRD3, MYO5B",16327,6.1864,0.011846,4.1542,0.068227,1.1660437246029862,False,160,,,324,3071.0
insomnia_ukb,Insomnia,sleep / brain-direct,Cluster400,400,Splat_400,Splatter,NEUR,CHOL VGLUT3,"Basal forebrain: 54.0%, Amygdala: 22.9%, Hypothalamus: 14.7%","Human SI: 18.9%, Human BNST: 13.9%, Human HTHpo: 11.7%","SLC5A7, LHX8, CHAT, NTRK1, ECEL1, ISL1, AC091576.1, INSRR, OR8A1, CNBD1",16327,3.9815,0.012187,2.675,0.068334,1.1653631566652407,False,161,,,400,769.0
insomnia_ukb,Insomnia,sleep / brain-direct,Cluster257,257,MGE_257,MGE interneuron,NEUR,GABA,"Cerebral cortex: 73.5%, Hippocampus: 19.7%, Amygdala: 3.5%","Human M1C: 9.5%, Human MTG: 5.2%, Human CA1U-CA2U-CA3U: 4.6%","MEPE, WNT16, MTND6P22, RGS5, HGF, RNF144B, AC006974.2, AC006364.1, LHX6, CPED1",16327,8.7394,0.011713,5.9147,0.069774,1.156306379097218,False,162,,,257,12242.0
insomnia_ukb,Insomnia,sleep / brain-direct,Cluster162,162,Amex_162,Amygdala excitatory,NEUR,VGLUT1 VGLUT2,"Amygdala: 84.9%, Hippocampus: 8.9%, Cerebral cortex: 6.2%","Human BL: 29.2%, Human CMN: 27.0%, Human BM: 25.5%","AC018742.1, POSTN, MEPE, MCOLN3, P2RX2, LINC01885, LINC01606, AC009411.2, DCDC2C, SYTL1",16327,7.1569,0.011396,4.8717,0.07092,1.1492312730711198,False,163,,,162,807.0
insomnia_ukb,Insomnia,sleep / brain-direct,Cluster385,385,Splat_385,Splatter,NEUR,VGLUT2,"Hypothalamus: 93.4%, Midbrain: 4.5%, Amygdala: 0.8%","Human HTHma-HTHtub: 46.9%, Human HTHtub: 19.6%, Human HTHma: 9.9%","LMX1A, LMX1B, LINC01667, CARTPT, IRX3, CRNDE, AR, TMEM255A, GABRE, IRX6",16327,8.4383,0.011456,5.7732,0.071933,1.1430718268634479,False,164,,,385,1800.0
insomnia_ukb,Insomnia,sleep / brain-direct,Cluster394,394,Splat_394,Splatter,NEUR,VGLUT2,"Pons: 92.2%, Midbrain: 6.7%, Medulla: 0.5%","Human PB: 78.3%, Human DTg: 10.3%, Human PAG: 4.6%","NPS, LINC01798, IRX4, SLC5A7, LHX9, AC006296.3, AC074099.1, IRX2, LINC01876, TH",16327,6.3847,0.011444,4.3723,0.072123,1.141926216831108,False,165,,,394,1791.0
insomnia_ukb,Insomnia,sleep / brain-direct,Cluster453,453,Thex_453,Thalamic excitatory,,VGLUT2,"Thalamus: 82.7%, Midbrain: 17.3%, Cerebral cortex: 0.0%","Human LG: 29.5%, Human MG: 24.7%, Human PTR: 14.4%","CARTPT, CASQ2, ST8SIA6-AS1, PLEKHG4B, RGS16, LEF1, PVALB, PPP1R17, CYP27C1, LINC00868",16327,5.2478,0.011358,3.6037,0.072678,1.138597032394753,False,166,,,453,5556.0
insomnia_ukb,Insomnia,sleep / brain-direct,Cluster436,436,Midi_436,Midbrain-derived inhibitory,NEUR,GABA,"Thalamus: 82.2%, Midbrain: 17.5%, Hypothalamus: 0.1%","Human LG: 28.3%, Human Pul: 26.3%, Human SC: 7.5%","HMCN1, LINC01210, OTX2, SOX14, DMBX1, AC246817.2, OTX2-AS1, AC245123.1, AL133493.1, AC007159.1",16327,6.8147,0.011444,4.7063,0.073823,1.1318083100348044,False,167,,,436,13890.0
insomnia_ukb,Insomnia,sleep / brain-direct,Cluster202,202,DG_202,Hippocampal dentate gyrus,NEUR,VGLUT1,"Hippocampus: 100.0%, Cerebral cortex: 0.0%, Amygdala: 0.0%","Human DGR-CA4Rpy: 87.7%, Human CA1R-CA2R-CA3R: 12.3%","TTR, FOLR1, LINC01697, AC097528.1, AC097487.1, AL672167.1, NTF3, AL591518.1, TARID, AJ006995.1",16327,6.7869,0.011255,4.6993,0.074349,1.1287248683982818,False,168,,,202,398.0
insomnia_ukb,Insomnia,sleep / brain-direct,Cluster265,265,LLC_265,LAMP5-LHX6 and Chandelier,NEUR,GABA,"Cerebral cortex: 72.8%, Amygdala: 17.1%, Hippocampus: 5.1%","Human MEC: 6.1%, Human M1C: 4.8%, Human BL: 4.2%","AC046195.2, LINC00943, PCDH18, COL15A1, PTHLH, C1QL1, LINC01837, NOG, CA8, PLEKHH2",16327,7.3024,0.011279,5.1072,0.076394,1.1169407496601407,False,169,,,265,4251.0
insomnia_ukb,Insomnia,sleep / brain-direct,Cluster442,442,Midi_442,Midbrain-derived inhibitory,NEUR,GABA,"Thalamus: 99.1%, Midbrain: 0.8%, Pons: 0.1%","Human Pul: 22.3%, Human MD: 18.2%, Human LP: 13.8%","AL137100.3, CASR, AL161757.4, OTX2-AS1, OTX2, DMBX1, TSPAN12, LINC01210, NPSR1, VASH2",16327,6.7155,0.011345,4.6975,0.076431,1.1167304582007018,False,170,,,442,7951.0
insomnia_ukb,Insomnia,sleep / brain-direct,Cluster129,129,ULIT_129,Upper-layer intratelencephalic,NEUR,VGLUT1 VGLUT2,"Cerebral cortex: 99.1%, Hippocampus: 0.4%, Basal forebrain: 0.4%","Human MTG: 14.4%, Human A44-A45: 8.5%, Human A46: 6.7%","LINC02296, LINC00326, AC110014.1, AC016598.2, AJ009632.2, LINC01478, AC016598.1, AC008696.2, LINC00508, LINC00507",16327,7.9765,0.01121,5.5817,0.076507,1.1162988273000551,False,171,,,129,46343.0
insomnia_ukb,Insomnia,sleep / brain-direct,Cluster272,272,LLC_272,LAMP5-LHX6 and Chandelier,NEUR,GABA,"Cerebral cortex: 67.5%, Amygdala: 16.1%, Basal forebrain: 7.8%","Human MEC: 6.2%, Human FI: 5.9%, Human LEC: 4.8%","LINC01344, SFRP1, ANO1, PDGFD, EYA4, FREM2, AP002989.1, CHRDL1, HAPLN1, ADGRG6",16327,6.2038,0.01122,4.3462,0.076742,1.1149668866904074,False,172,,,272,1960.0
insomnia_ukb,Insomnia,sleep / brain-direct,Cluster254,254,MGE_254,MGE interneuron,NEUR,GABA VGLUT3,"Cerebral cortex: 77.9%, Hippocampus: 13.0%, Amygdala: 4.5%","Human M1C: 8.3%, Human MTG: 6.2%, Human MEC: 4.6%","LINC01035, KLHL14, AL450345.2, ITGA1, PAWR, FBN2, AL590608.1, AC022133.2, SLC17A8, SST",16327,6.2136,0.011687,4.3714,0.077606,1.1101047005696698,False,173,,,254,7539.0
insomnia_ukb,Insomnia,sleep / brain-direct,Cluster98,98,DLCT6b_98,Deep-layer corticothalamic and 6b,NEUR,VGLUT1,"Cerebral cortex: 75.6%, Basal forebrain: 10.3%, Amygdala: 7.8%","Human MTG: 8.1%, Human FI: 8.1%, Human M1C: 5.9%","ERG, CCN2, AC079949.3, SLC15A5, SCUBE1, AC002331.1, CDH24, DPP4, TNIP3, OLFML2B",16327,6.2802,0.01091,4.4382,0.07854,1.1049091030656006,False,174,,,98,4953.0
insomnia_ukb,Insomnia,sleep / brain-direct,Cluster306,306,CBI_306,Cerebellar inhibitory,,GABA,"Cerebellum: 91.6%, Pons: 3.4%, Medulla: 3.3%","Human CBV: 84.2%, Human CBL: 7.2%, Human PnEN: 1.5%","SCGN, TFAP2B, LIPG, LMCD1, LRRC38, BHLHE22, TFAP2A, LBX1-AS1, EN2, CHRNA3",16327,5.1049,0.011004,3.6371,0.080235,1.0956361430493018,False,175,,,306,6586.0
insomnia_ukb,Insomnia,sleep / brain-direct,Cluster365,365,Splat_365,Splatter,NEUR,GABA VGLUT2,"Pons: 43.0%, Midbrain: 30.2%, Medulla: 17.1%","Human DTg: 13.8%, Human PnEN: 12.8%, Human MoRF-MoEN: 11.6%","SLC6A5, GLRA1, ONECUT1, LHX5-AS1, MAB21L2, LHX1, LINC01933, ASAH2, KLHL1, IGDCC4",16327,7.9962,0.010946,5.746,0.08203,1.086027288449029,False,176,,,365,28081.0
insomnia_ukb,Insomnia,sleep / brain-direct,Cluster319,319,LRL_319,Lower rhombic lip,NEUR,VGLUT1 VGLUT2,"Pons: 97.8%, Midbrain: 1.2%, Medulla: 1.0%","Human PN: 45.9%, Human PnEN: 25.5%, Human PnRF: 15.0%","LINC00355, IRX2, AL139351.3, AC136431.1, AC093765.2, S100A10, ADAMTS20, LINC02476, CDH23, BARHL1",16327,5.2805,0.011052,3.797,0.082168,1.0852972837886325,False,177,,,319,8164.0
insomnia_ukb,Insomnia,sleep / brain-direct,Cluster330,330,Mmb_330,Mammillary body,NEUR,VGLUT2,"Hypothalamus: 100.0%, Cerebral cortex: 0.0%, Amygdala: 0.0%","Human MN: 44.6%, Human HTHma-HTHtub: 36.1%, Human HTHma: 19.2%","AC244258.1, AL691420.1, PITX2, FOXB1, SIM1, ANXA3, LHX1-DT, AC087664.2, AC093912.1, LHX1",16327,5.8602,0.010839,4.2994,0.086446,1.0632550974521529,False,178,,,330,1808.0
insomnia_ukb,Insomnia,sleep / brain-direct,Cluster56,56,Astro_56,Astrocyte,ASTRO,,"Hypothalamus: 30.0%, Thalamus: 21.5%, Amygdala: 14.3%","Human HTHso: 21.4%, Human VLN: 10.7%, Human HTHtub: 7.1%","TNC, GFAP, OBI1-AS1, FGFR3, GJA1, AC012405.1, EFEMP1, AQP4, SLC14A1, ETNPPL",16327,4.0552,0.010781,2.9768,0.086569,1.0626375991973953,False,179,,,56,1672.0
insomnia_ukb,Insomnia,sleep / brain-direct,Cluster46,46,Oligo_46,Oligodendrocyte,OLIGO,,"Thalamus: 22.7%, Midbrain: 19.9%, Cerebral cortex: 13.7%","Human SN-RN: 9.7%, Human SN: 6.7%, Human CbDN: 5.9%","CNDP1, LINC01608, OPALIN, RNASE1, LINC01792, NKX6-2, MAG, PPP1R14A, CD9, TMEM98",16327,3.1051,0.010523,2.2828,0.086889,1.0610352010160444,False,180,,,46,60616.0
insomnia_ukb,Insomnia,sleep / brain-direct,Cluster451,451,Thex_451,Thalamic excitatory,,VGLUT2,"Thalamus: 99.9%, Midbrain: 0.1%, Hypothalamus: 0.0%","Human MD: 29.1%, Human ETH: 20.1%, Human ANC: 18.7%","CASQ2, AC016766.1, LINC00868, RGS16, C2orf83, TGFBR2, CYP27C1, AC106874.1, AOX2P, SHOX2",16327,5.2244,0.01072,3.8602,0.087974,1.0556456610878284,False,181,,,451,9740.0
insomnia_ukb,Insomnia,sleep / brain-direct,Cluster200,200,DG_200,Hippocampal dentate gyrus,NEUR,VGLUT1,"Hippocampus: 99.4%, Thalamus: 0.5%, Midbrain: 0.1%","Human CA4C-DGC: 59.1%, Human DGR-CA4Rpy: 18.1%, Human DGU-CA4Upy: 11.3%","LINC01697, AC097487.1, AJ006995.1, CHRNA1, TARID, AC097528.1, AC079793.1, NTF3, MCOLN3, COL6A3",16327,4.8219,0.0098835,3.5719,0.088527,1.0529242528878162,False,182,,,200,23293.0
insomnia_ukb,Insomnia,sleep / brain-direct,Cluster245,245,MGE_245,MGE interneuron,NEUR,GABA,"Amygdala: 50.6%, Cerebral cortex: 31.0%, Hippocampus: 15.3%","Human CMN: 23.8%, Human BL: 9.2%, Human BM: 7.6%","NPY, LINC02397, ELFN1, SST, MCUB, AC022905.1, STK32B, TNFSF15, AC105411.1, AC113347.4",16327,7.4125,0.010608,5.4994,0.088859,1.0512985785239755,False,183,,,245,1566.0
insomnia_ukb,Insomnia,sleep / brain-direct,Cluster266,266,LLC_266,LAMP5-LHX6 and Chandelier,NEUR,GABA,"Amygdala: 42.8%, Hippocampus: 27.1%, Cerebral cortex: 25.1%","Human CMN: 12.5%, Human BL: 8.8%, Human La: 8.4%","IL18R1, C1QL1, COL15A1, IBSP, LINC01837, CPED1, LINC00943, GRIN2C, LHX6, PTHLH",16327,7.1098,0.010393,5.2821,0.089162,1.0498201983880533,False,184,,,266,3566.0
insomnia_ukb,Insomnia,sleep / brain-direct,Cluster450,450,Thex_450,Thalamic excitatory,,VGLUT2,"Thalamus: 99.9%, Basal forebrain: 0.0%, Hypothalamus: 0.0%","Human MD: 45.8%, Human ANC: 20.8%, Human ETH: 14.5%","CASQ2, RGS16, AC016766.1, SHOX2, GDNF, TGFBR2, FAM20A, VANGL1, IRAG1, LINC00868",16327,4.9556,0.010573,3.6933,0.089842,1.0465205886778568,False,185,,,450,3092.0
insomnia_ukb,Insomnia,sleep / brain-direct,Cluster23,23,Per_23,Vascular,,,"Thalamus: 48.8%, Cerebral cortex: 25.0%, Basal forebrain: 10.7%","Human Pul: 31.0%, Human STG: 7.1%, Human LP: 6.0%","ITIH5, SLC6A12, SLC6A13, ATP1A2, DCN, PRELP, COLEC12, IFITM2, MUSTN1, TFPI",16327,1.9062,0.010059,1.4269,0.090799,1.0419189344841286,False,186,,,23,84.0
insomnia_ukb,Insomnia,sleep / brain-direct,Cluster253,253,MGE_253,MGE interneuron,NEUR,GABA,"Cerebral cortex: 81.1%, Amygdala: 8.4%, Basal forebrain: 6.1%","Human M1C: 8.3%, Human FI: 6.3%, Human MTG: 5.3%","LINC00943, SCARA5, AC092353.2, AL450345.2, SST, LHX6, PAWR, TH, TLL2, NMU",16327,6.8324,0.010373,5.134,0.091637,1.0379291371252883,False,187,,,253,5703.0
insomnia_ukb,Insomnia,sleep / brain-direct,Cluster154,154,Amex_154,Amygdala excitatory,NEUR,VGLUT1 VGLUT2,"Amygdala: 87.5%, Cerebral cortex: 6.8%, Hippocampus: 5.7%","Human BL: 55.4%, Human La: 20.5%, Human BM: 8.2%","DCSTAMP, AL445207.1, PTGER3, AC005909.2, LINC01821, SMIM36, AC099517.1, AC018742.1, AC022655.1, AC004704.1",16327,5.6963,0.0099449,4.2923,0.092248,1.0350430408694933,False,188,,,154,7970.0
insomnia_ukb,Insomnia,sleep / brain-direct,Cluster369,369,Splat_369,Splatter,NEUR,VGLUT2,"Midbrain: 96.5%, Thalamus: 2.3%, Pons: 0.6%","Human PTR: 42.2%, Human SC: 39.6%, Human IC: 6.3%","TFAP2B, FOXB1, LHX9, TFAP2D, SHOX2, NTS, EBF3, FAM9B, LEF1, AC074237.1",16327,7.4466,0.010252,5.6412,0.093422,1.0295508394709907,False,189,,,369,2975.0
insomnia_ukb,Insomnia,sleep / brain-direct,Cluster150,150,DLIT_150,Deep-layer intratelencephalic,NEUR,VGLUT1 VGLUT2,"Cerebral cortex: 95.3%, Hippocampus: 2.2%, Basal forebrain: 1.3%","Human M1C: 11.9%, Human MTG: 7.3%, Human A23: 4.7%","SMYD1, OLFML2B, SMIM32, POSTN, THEMIS, AL136119.1, MCTP2, GAS2L3, AL356432.3, NTNG2",16327,5.0023,0.010179,3.7905,0.09348,1.0292812962798108,False,190,,,150,12307.0
insomnia_ukb,Insomnia,sleep / brain-direct,Cluster220,220,MSN_220,Medium spiny neuron,NEUR,GABA,"Amygdala: 91.6%, Thalamus: 8.4%, Cerebral cortex: 0.0%","Human CEN: 87.5%, Human VA: 6.4%, Human La: 2.6%","FAM9B, ISL1, AC010478.1, PTGDR, NPNT, EBF1, DRD1, MYO3A, LPL, GDNF-AS1",16327,6.7958,0.010401,5.1643,0.094111,1.0263596118532912,False,191,,,220,391.0
insomnia_ukb,Insomnia,sleep / brain-direct,Cluster219,219,MSN_219,Medium spiny neuron,NEUR,GABA,"Amygdala: 33.2%, Basal forebrain: 32.8%, Hypothalamus: 18.6%","Human SI: 31.0%, Human BNST: 23.2%, Human HTHpo: 13.6%","ISL1, NPNT, AC010478.1, LINC02462, PROK2, AC015631.1, DRD3, AC022433.1, NMBR, LINC01951",16327,5.8364,0.0098347,4.5248,0.098561,1.0062948988050686,False,192,,,219,8342.0
insomnia_ukb,Insomnia,sleep / brain-direct,Cluster406,406,Amex_406,Amygdala excitatory,NEUR,VGLUT1 VGLUT2,"Amygdala: 50.5%, Cerebral cortex: 46.9%, Hypothalamus: 2.4%","Human Pir: 27.1%, Human A35-A36: 18.8%, Human CoA: 17.9%","RXFP2, AC112178.1, SCUBE1, FBXL21P, TFAP2D, IRAG2, AC109439.1, PLEKHG4B, CARTPT, NDST4",16327,5.7249,0.01001,4.4838,0.10085,0.9963240974512158,False,193,,,406,4858.0
insomnia_ukb,Insomnia,sleep / brain-direct,Cluster224,224,EMSN_224,Eccentric medium spiny neuron,NEUR,GABA,"Basal forebrain: 70.9%, Amygdala: 13.6%, Cerebral cortex: 8.2%","Human SI: 29.8%, Human NAC: 26.6%, Human BNST: 13.0%","SLC35D3, CASZ1, AL590867.1, AC022133.2, FBXL21P, AC022126.1, DRD1, LECT2, C6orf141, RXRG",16327,7.1819,0.010169,5.6305,0.10107,0.9953777342992174,False,194,,,224,4297.0
insomnia_ukb,Insomnia,sleep / brain-direct,Cluster391,391,Splat_391,Splatter,NEUR,GABA,"Hypothalamus: 92.3%, Thalamus: 3.3%, Midbrain: 2.8%","Human HTHpo-HTHso: 48.5%, Human HTHma-HTHtub: 13.7%, Human HTHma: 12.2%","SFRP1, AVP, PDGFD, AL158013.1, EGFL6, ABI3BP, GBX1, NFIA-AS2, AC008415.1, LINC01938",16327,5.439,0.0095646,4.2803,0.10193,0.9916979757879986,False,195,,,391,827.0
insomnia_ukb,Insomnia,sleep / brain-direct,Cluster343,343,Splat_343,Splatter,NEUR,VGLUT2,"Medulla: 57.2%, Spinal cord: 34.1%, Pons: 5.9%","Human MoAN: 47.7%, Human SpC: 34.1%, Human MoSR: 9.2%","EBF2, DRGX, LMX1B, EBF1, MAFA, EBF3, HOXB7, HOXB3, AC024230.1, HOXD3",16327,3.7647,0.010801,2.9704,0.10251,0.9892337664815748,False,196,,,343,2797.0
insomnia_ukb,Insomnia,sleep / brain-direct,Cluster397,397,Splat_397,Splatter,NEUR,SER VGLUT3,"Pons: 80.1%, Medulla: 8.1%, Midbrain: 7.6%","Human PnRF: 26.5%, Human PnEN: 26.2%, Human DTg: 23.2%","TPH2, SLC6A4, FEV, SLC18A2, LMX1B, DDC, GATA3, NDNF, VWA5B1, AMIGO2",16327,4.3679,0.0096673,3.4545,0.10305,0.9869520038847683,False,197,,,397,1316.0
insomnia_ukb,Insomnia,sleep / brain-direct,Cluster434,434,Midi_434,Midbrain-derived inhibitory,NEUR,GABA,"Thalamus: 89.3%, Midbrain: 8.9%, Pons: 1.3%","Human VLN: 16.5%, Human LG: 15.2%, Human LP: 14.1%","NPSR1, CASR, LINC01210, OTX2, AL161757.4, SOX14, DMBX1, AL137100.3, NPPC, AL133493.1",16327,5.8733,0.010182,4.6509,0.10333,0.9857735706107705,False,198,,,434,8469.0
insomnia_ukb,Insomnia,sleep / brain-direct,Cluster276,276,CGE_276,CGE interneuron,NEUR,GABA VGLUT3,"Hippocampus: 73.7%, Amygdala: 13.0%, Cerebral cortex: 10.8%","Human CA3R: 12.6%, Human CA4C-DGC: 12.2%, Human CA1U-CA2U-CA3U: 11.2%","SHISAL2B, HTR3A, SLC17A8, LINC01997, GAS2L3, SCGN, AC112178.1, GPC3, PTGFR, ACADL",16327,6.1518,0.0097516,4.9114,0.1052,0.9779842601822797,False,199,,,276,2080.0
insomnia_ukb,Insomnia,sleep / brain-direct,Cluster88,88,DLNP_88,Deep-layer near-projecting,NEUR,VGLUT1,"Cerebral cortex: 92.2%, Basal forebrain: 4.8%, Amygdala: 1.9%","Human MTG: 15.3%, Human Idg: 10.9%, Human FI: 7.9%","IFNG-AS1, LINC02218, NPSR1-AS1, NPSR1, CD200R1L, AC244502.1, AC005909.2, IL26, CD36, CDCP1",16327,6.05,0.0097726,4.8378,0.10555,0.9765417623563248,False,200,,,88,1548.0
insomnia_ukb,Insomnia,sleep / brain-direct,Cluster95,95,DLNP_95,Deep-layer near-projecting,NEUR,VGLUT1,"Cerebral cortex: 89.0%, Basal forebrain: 7.0%, Hypothalamus: 3.3%","Human A25: 21.2%, Human ACC: 13.9%, Human AON: 12.5%","NPSR1-AS1, AC009081.2, ERG, CCDC80, HMGA2, MYOCD, PDLIM1, CD200R1L, FSHR, GNAT3",16327,5.0259,0.0096177,4.0352,0.10648,0.9727319575333813,False,201,,,95,1307.0
insomnia_ukb,Insomnia,sleep / brain-direct,Cluster84,84,DLCT6b_84,Deep-layer corticothalamic and 6b,NEUR,VGLUT1 VGLUT2 VGLUT3,"Hippocampus: 98.5%, Amygdala: 0.8%, Cerebral cortex: 0.7%","Human CA1U-CA2U-CA3U: 20.1%, Human CA2U-CA3U: 19.3%, Human CA1-2R: 13.5%","PIWIL1, NPSR1-AS1, SLC9C1, IFNG-AS1, LINC02218, LINC01479, CPZ, ABCA12, LPO, C3orf52",16327,5.9547,0.0098737,4.7846,0.10666,0.9719984206531421,False,202,,,84,4474.0
insomnia_ukb,Insomnia,sleep / brain-direct,Cluster335,335,Splat_335,Splatter,NEUR,VGLUT2,"Medulla: 78.3%, Pons: 15.9%, Midbrain: 4.8%","Human IO: 70.8%, Human PnRF: 13.5%, Human MoSR: 3.2%","HSPD1P8, AC092445.1, LINC00331, POU4F1, TES, HOXD3, AC096773.1, PDLIM1, AC093772.1, LINC00581",16327,3.5362,0.0097742,2.8492,0.10729,0.9694407547088444,False,203,,,335,993.0
