insomnia_ukb,Insomnia,sleep / brain-direct,Cluster51,51,Bgl_51,Bergmann glia,ASTRO,,"Cerebellum: 95.8%, Pons: 1.9%, Medulla: 1.9%","Human CBV: 82.3%, Human CBL: 13.3%, Human MoAN: 1.3%","LINC01727, PAX3, AL627316.1, LCAT, AL355306.2, LINC01726, SMTN, AC098656.1, LGR6, AL449403.3",16327,1.2585,0.0056778,1.7674,0.23822,0.6230217796919838,False,272,,,51,8041.0
insomnia_ukb,Insomnia,sleep / brain-direct,Cluster147,147,DLIT_147,Deep-layer intratelencephalic,NEUR,VGLUT1,"Cerebral cortex: 65.1%, Amygdala: 19.4%, Basal forebrain: 11.8%","Human Cla: 9.4%, Human FI: 6.8%, Human Idg: 5.9%","CCN4, TMEM233, AP000331.1, THEMIS, AC079163.2, RXFP2, VIT, AC011754.1, SH2D1B, PXDN",16327,4.3087,0.0054785,6.1117,0.24042,0.6190294071836566,False,273,,,147,13265.0
insomnia_ukb,Insomnia,sleep / brain-direct,Cluster460,460,Thex_460,Thalamic excitatory,NEUR,VGLUT2,"Thalamus: 98.9%, Midbrain: 0.9%, Cerebral cortex: 0.1%","Human CM-Pf: 41.9%, Human CM: 30.5%, Human ETH: 13.0%","LINC01239, DMRTA1, MUC7, AC092445.1, AL159156.1, LINC01151, AC037486.1, ITIH5, SMILR, COL6A5",16327,1.0424,0.0064638,1.483,0.24106,0.6178748477746784,False,274,,,460,7103.0
insomnia_ukb,Insomnia,sleep / brain-direct,Cluster322,322,LRL_322,Lower rhombic lip,NEUR,VGLUT1 VGLUT2,"Pons: 83.9%, Medulla: 15.5%, Cerebral cortex: 0.4%","Human PnEN: 48.0%, Human DTg: 22.6%, Human MoRF-MoEN: 8.5%","LINC01982, AL359208.1, BMP5, AC007422.1, ADAMTS20, SLC5A7, EGFLAM, AL139351.3, INSRR, NTRK1",16327,2.1226,0.0058257,3.02,0.24108,0.617838817204126,False,275,,,322,504.0
insomnia_ukb,Insomnia,sleep / brain-direct,Cluster357,357,Splat_357,Splatter,NEUR,GABA,"Midbrain: 97.4%, Pons: 1.6%, Thalamus: 0.9%","Human SC: 32.6%, Human PTR: 30.3%, Human PAG: 17.5%","TFAP2B, EMX2, LINC01497, PAX7, EMX2OS, FAM9B, GATA3, AC005208.1, LEF1, LHX5-AS1",16327,3.155,0.0052747,4.5483,0.24395,0.612699177551715,False,276,,,357,2674.0
insomnia_ukb,Insomnia,sleep / brain-direct,Cluster256,256,MGE_256,MGE interneuron,NEUR,GABA VGLUT3,"Cerebral cortex: 68.6%, Hippocampus: 21.8%, Basal forebrain: 5.0%","Human M1C: 8.3%, Human Sub: 6.3%, Human CA1U-CA2U-CA3U: 6.0%","WNT16, AC046195.2, MEPE, MYBPC1, AC006364.1, SRPK3, CPED1, AC106865.1, LHX6, AC022905.1",16327,3.6877,0.0055268,5.3242,0.24428,0.6121120886761721,False,277,,,256,5526.0
insomnia_ukb,Insomnia,sleep / brain-direct,Cluster54,54,Astro_54,Astrocyte,ASTRO,,"Cerebral cortex: 38.8%, Hippocampus: 33.1%, Amygdala: 22.1%","Human A35r: 18.3%, Human CA1: 15.4%, Human Sub: 12.0%","ETNPPL, LINC00499, GLI3, OBI1-AS1, FGFR3, PAPLN, AC097518.2, GJA1, AL160272.2, RANBP3L",16327,1.792,0.0054317,2.6028,0.24557,0.6098246897713296,False,278,,,54,24168.0
insomnia_ukb,Insomnia,sleep / brain-direct,Cluster225,225,EMSN_225,Eccentric medium spiny neuron,NEUR,GABA,"Amygdala: 47.2%, Basal forebrain: 33.3%, Cerebral cortex: 10.2%","Human SI: 15.2%, Human BNST: 14.1%, Human La: 12.0%","AC008786.1, ZNF736P9Y, LMNTD1, CASZ1, OTOF, S100Z, AC068633.1, DNAH8, CALCRL, MUC19",16327,3.4899,0.0054524,5.0937,0.24663,0.6079540970751891,False,279,,,225,2296.0
insomnia_ukb,Insomnia,sleep / brain-direct,Cluster168,168,Misc_168,Miscellaneous,NEUR,VGLUT1 VGLUT2,"Cerebral cortex: 92.4%, Hippocampus: 7.6%, Amygdala: 0.0%","Human TH-TL: 56.3%, Human MEC: 34.4%, Human Sub: 4.4%","GRB14, DUXAP9, SCHLAP1, MET, TWIST2, LINC01297, LINC01524, DUXAP10, FER1L6-AS2, DCN",16327,2.8232,0.0053076,4.1631,0.24885,0.6040623549199581,False,280,,,168,631.0
insomnia_ukb,Insomnia,sleep / brain-direct,Cluster235,235,Splat_235,Splatter,NEUR,GABA,"Cerebral cortex: 31.8%, Amygdala: 28.5%, Basal forebrain: 25.2%","Human SI: 7.7%, Human CEN: 6.9%, Human Pu: 5.7%","NPY, CORT, SST, NOS1, AC005837.1, TLL2, CRHBP, TENT5A, TACR1, LHX6",16327,1.9289,0.004705,2.8524,0.24945,0.6030164917247995,False,281,,,235,3850.0
insomnia_ukb,Insomnia,sleep / brain-direct,Cluster431,431,Splat_431,Splatter,NEUR,HDC VGLUT2,"Hypothalamus: 99.7%, Midbrain: 0.2%, Cerebral cortex: 0.0%","Human MN: 57.0%, Human HTHma-HTHtub: 14.2%, Human HTHso-HTHtub: 13.8%","PGR, TBX3, PGR-AS1, AC004870.4, AC026765.3, CALCR, POMC, NR5A2, ESR1, C14orf39",16327,1.869,0.0051213,2.7964,0.25196,0.598668400322165,False,282,,,431,2691.0
insomnia_ukb,Insomnia,sleep / brain-direct,Cluster135,135,ULIT_135,Upper-layer intratelencephalic,NEUR,VGLUT1 VGLUT2,"Cerebral cortex: 95.4%, Basal forebrain: 2.7%, Hippocampus: 1.0%","Human M1C: 10.7%, Human A1C: 7.5%, Human MTG: 6.2%","LINC01915, COL22A1, AL353811.1, LINC01164, IZUMO3, AL157769.1, LINC01781, ITGA11, TWIST2, AC008459.1",16327,2.3697,0.0047351,3.5731,0.25361,0.5958336259512064,False,283,,,135,28248.0
insomnia_ukb,Insomnia,sleep / brain-direct,Cluster117,117,L5ET_117,Miscellaneous,NEUR,VGLUT1,"Cerebral cortex: 82.3%, Basal forebrain: 7.9%, Hypothalamus: 7.7%","Human ACC: 23.6%, Human FI: 16.3%, Human AON: 14.0%","ABCB11, AC016074.2, ATP6V1C2, MIR548XHG, GABRQ, LINC00607, AP003062.2, LINC02717, FEZF2, AC068787.2",16327,2.5105,0.0050936,3.8004,0.25444,0.5944146130955053,False,284,,,117,2655.0
insomnia_ukb,Insomnia,sleep / brain-direct,Cluster448,448,Thex_448,Thalamic excitatory,NEUR,VGLUT2,"Thalamus: 99.7%, Amygdala: 0.3%, Basal forebrain: 0.0%","Human VLN: 59.6%, Human CM-Pf: 18.2%, Human LP: 13.2%","CASQ2, AC093298.2, GDNF, CHRNA2, AL033530.1, FAM20A, TAFA4, MATN3, ST8SIA6, COL4A4",16327,1.7748,0.0050083,2.7223,0.25722,0.5896952661057236,False,285,,,448,5500.0
insomnia_ukb,Insomnia,sleep / brain-direct,Cluster338,338,Splat_338,Splatter,NEUR,VGLUT2,"Medulla: 99.1%, Basal forebrain: 0.6%, Pons: 0.3%","Human MoAN: 53.4%, Human MoSR: 34.0%, Human MoRF-MoEN: 11.7%","LINC02058, AC004080.1, FSHR, HOXD3, ASAH2, EBF1, PPP1R1C, HOXB3, IGFBP7, LNCTAM34A",16327,2.0449,0.0053532,3.1525,0.25828,0.5879092222661981,False,286,,,338,350.0
insomnia_ukb,Insomnia,sleep / brain-direct,Cluster246,246,MGE_246,MGE interneuron,NEUR,GABA,"Hippocampus: 72.3%, Cerebral cortex: 16.5%, Amygdala: 8.9%","Human CA4C-DGC: 21.5%, Human CA3R: 12.6%, Human CA1C-CA3C: 9.5%","AC113347.4, PROM1, ELFN1, SST, LINC02192, TNFSF15, TAC1, LINC01687, DEPDC1, NGF",16327,2.9018,0.0052077,4.5559,0.26209,0.5815495491704165,False,287,,,246,2100.0
insomnia_ukb,Insomnia,sleep / brain-direct,Cluster419,419,Amex_419,Amygdala excitatory,NEUR,VGLUT1 VGLUT2,"Amygdala: 78.9%, Cerebral cortex: 14.0%, Thalamus: 5.1%","Human CMN: 29.0%, Human BM: 24.6%, Human CEN: 18.4%","AC025244.1, AC096759.1, SCN5A, FAM9B, GABRQ, LINC01920, VWA5B1, CYP19A1, CARM1P1, LINC02498",16327,3.6416,0.0047841,5.7465,0.26314,0.579813129645714,False,288,,,419,2170.0
insomnia_ukb,Insomnia,sleep / brain-direct,Cluster59,59,Astro_59,Astrocyte,ASTRO,,"Pons: 36.2%, Cerebellum: 36.1%, Medulla: 10.9%","Human CbDN: 36.1%, Human PnEN: 13.6%, Human PnRF: 13.0%","LGR6, SDC4, ITPRID1, FGFR3, SLC14A1, SLC7A10, AC090809.1, GJB6, GFAP, PYGM",16327,1.1784,0.004871,1.8785,0.26524,0.5763609807600288,False,289,,,59,4062.0
insomnia_ukb,Insomnia,sleep / brain-direct,Cluster106,106,DLCT6b_106,Deep-layer corticothalamic and 6b,NEUR,VGLUT1,"Cerebral cortex: 99.0%, Hippocampus: 0.6%, Basal forebrain: 0.4%","Human M1C: 20.6%, Human MTG: 8.8%, Human A23: 6.8%","AC023503.1, MDFIC, AC022133.2, AL138927.1, AC104689.2, DPP4, NPFFR2, KRT17, OLFML2B, CCN2",16327,3.138,0.0049693,5.0346,0.26655,0.5742213131390173,False,290,,,106,9905.0
insomnia_ukb,Insomnia,sleep / brain-direct,Cluster318,318,LRL_318,Lower rhombic lip,NEUR,VGLUT1 VGLUT2,"Pons: 98.8%, Medulla: 0.7%, Midbrain: 0.5%","Human PN: 54.9%, Human PnEN: 17.1%, Human DTg: 14.1%","AC093765.2, AL139351.3, ADAMTS20, LINC00836, LINC00210, BMP5, AC136431.1, BARHL1, LINC00355, IRX2",16327,2.3104,0.0050031,3.7099,0.26672,0.5739444175160698,False,291,,,318,7999.0
insomnia_ukb,Insomnia,sleep / brain-direct,Cluster221,221,MSN_221,Medium spiny neuron,NEUR,GABA,"Basal forebrain: 78.8%, Amygdala: 9.0%, Cerebral cortex: 6.5%","Human SI: 19.8%, Human Pu: 16.4%, Human NAC: 15.6%","AC048352.1, GPR6, LINC01305, DRD2, AC005482.1, RDH10, SIX3, LOXHD1, AC023905.1, AL392086.1",16327,2.5886,0.0047776,4.1575,0.26677,0.573863011213576,False,292,,,221,2571.0
insomnia_ukb,Insomnia,sleep / brain-direct,Cluster212,212,MSN_212,Medium spiny neuron,NEUR,GABA,"Basal forebrain: 90.4%, Cerebral cortex: 3.6%, Amygdala: 3.6%","Human CaB: 25.4%, Human Pu: 22.3%, Human NAC: 18.4%","PENK, AL139379.1, GPR6, DRD2, AL450332.1, ADORA2A, AC107208.1, GPR88, AC092979.1, LINC02137",16327,2.6876,0.0049367,4.3451,0.26811,0.5716869873456315,False,293,,,212,6867.0
insomnia_ukb,Insomnia,sleep / brain-direct,Cluster339,339,Splat_339,Splatter,NEUR,GLY VGLUT2,"Pons: 99.4%, Medulla: 0.4%, Midbrain: 0.2%","Human DTg: 39.1%, Human PnRF: 35.2%, Human PB: 16.6%","SLC6A5, GLRA1, LINC01956, LGI2, EN1, LINC01798, ADGRD2, ASAH2, HOXB-AS1, MAB21L2",16327,2.6726,0.0046066,4.3803,0.27089,0.5672070268050698,False,294,,,339,489.0
insomnia_ukb,Insomnia,sleep / brain-direct,Cluster345,345,Splat_345,Splatter,NEUR,VGLUT2,"Medulla: 52.3%, Spinal cord: 35.4%, Midbrain: 6.8%","Human MoAN: 42.2%, Human SpC: 35.4%, Human MoSR: 9.3%","LMX1B, DRGX, SKOR2, HOXB7, HOXB3, EBF3, EBF2, EBF1, TLX3, HOXD3",16327,1.7579,0.0048872,2.8841,0.2711,0.5668704824195144,False,295,,,345,2720.0
insomnia_ukb,Insomnia,sleep / brain-direct,Cluster58,58,Astro_58,Astrocyte,ASTRO,,"Cerebral cortex: 57.1%, Hippocampus: 37.8%, Amygdala: 3.0%","Human CA4C-DGC: 9.8%, Human TH-TL: 5.9%, Human DGR-CA4Rpy: 5.6%","ID3, AQP4, GFAP, FGFR3, MLC1, F3, AGT, MT1G, AL137139.2, EMX2",16327,1.3502,0.0048717,2.2253,0.27202,0.5653991637219795,False,296,,,58,8021.0
insomnia_ukb,Insomnia,sleep / brain-direct,Cluster302,302,CBI_302,Cerebellar inhibitory,NEUR,GLY,"Cerebellum: 60.1%, Medulla: 19.0%, Pons: 15.3%","Human CBV: 42.3%, Human CBL: 12.9%, Human IO: 7.7%","CPLX4, AC010476.2, SLC6A5, PAX2, AC008725.1, AC068672.2, TFAP2B, LINC01179, AL139351.3, LGI2",16327,1.4728,0.0046572,2.4734,0.27578,0.5594372327380792,False,297,,,302,248.0
insomnia_ukb,Insomnia,sleep / brain-direct,Cluster57,57,Astro_57,Astrocyte,ASTRO,,"Hippocampus: 66.8%, Basal forebrain: 25.3%, Cerebral cortex: 4.0%","Human DGR-CA4Rpy: 26.6%, Human SEP: 21.1%, Human DGU-CA4Upy: 19.9%","CD38, OBI1-AS1, FGFR3, AL627316.1, AC012405.1, AL137139.2, TNC, LINC02649, GLI3, SLC14A1",16327,1.5135,0.0046544,2.5567,0.27694,0.557614312132129,False,298,,,57,6925.0
insomnia_ukb,Insomnia,sleep / brain-direct,Cluster236,236,MGE_236,MGE interneuron,NEUR,GABA,"Hippocampus: 61.2%, Cerebral cortex: 21.0%, Amygdala: 16.5%","Human CA1C-CA3C: 17.3%, Human CA1U-CA2U-CA3U: 11.6%, Human CA1R-CA2R-CA3R: 8.6%","LHX6, MYO5B, CRHBP, PRTG, AC022905.1, NGF, TRG-AS1, RGS5, TAC1, RASGRF2-AS1",16327,3.1384,0.0047166,5.3016,0.27694,0.557614312132129,False,299,,,236,4303.0
insomnia_ukb,Insomnia,sleep / brain-direct,Cluster410,410,Splat_410,Splatter,NEUR,VGLUT2,"Hypothalamus: 82.0%, Thalamus: 11.6%, Amygdala: 5.2%","Human HTHpo-HTHso: 58.9%, Human HTHtub: 15.3%, Human ANC: 11.5%","AVP, OXT, HCRT, SIM1, OTP, TRH, CARTPT, TH, AC092675.1, PGF",16327,1.8885,0.004346,3.2949,0.28327,0.5477994174469075,False,300,,,410,2511.0
insomnia_ukb,Insomnia,sleep / brain-direct,Cluster317,317,LRL_317,Lower rhombic lip,NEUR,VGLUT1 VGLUT2,"Pons: 97.6%, Medulla: 2.1%, Midbrain: 0.2%","Human PnRF: 36.1%, Human PnEN: 23.6%, Human PN: 22.5%","BMP5, ADAMTS20, AL139351.3, AC093765.2, INSRR, LINC00836, CDH23, AC136431.1, IRX2, EGFLAM",16327,1.9363,0.004747,3.3876,0.2838,0.5469876088785448,False,301,,,317,4858.0
insomnia_ukb,Insomnia,sleep / brain-direct,Cluster303,303,CBI_303,Cerebellar inhibitory,,GABA,"Cerebellum: 96.8%, Pons: 1.5%, Medulla: 1.0%","Human CBV: 93.3%, Human CBL: 3.5%, Human PnEN: 0.7%","TFAP2B, AC010476.2, SCGN, AL162718.1, LIPG, XDH, LMCD1, TFAP2A, IL15, LRRC38",16327,1.3996,0.0042803,2.5087,0.28846,0.5399144008225314,False,302,,,303,1439.0
insomnia_ukb,Insomnia,sleep / brain-direct,Cluster459,459,Thex_459,Thalamic excitatory,NEUR,VGLUT2,"Thalamus: 89.9%, Amygdala: 9.2%, Midbrain: 0.6%","Human MD: 26.0%, Human CM-Pf: 20.8%, Human ANC: 20.7%","SLC15A1, COL6A5, LHX9, FSHR, LINC01997, SLITRK6, AC069410.1, GBX2, RERGL, CYP27C1",16327,2.4558,0.004428,4.4164,0.28909,0.5389669308818577,False,303,,,459,4507.0
insomnia_ukb,Insomnia,sleep / brain-direct,Cluster304,304,CBI_304,Cerebellar inhibitory,,GABA,"Cerebellum: 95.5%, Pons: 2.4%, Medulla: 1.8%","Human CBV: 87.2%, Human CBL: 8.3%, Human PnAN: 1.4%","SCGN, TFAP2B, LMCD1, LIPG, AL162718.1, CLCNKA, LRRC38, TFAP2A, BHLHE22, AC010476.2",16327,1.7721,0.0042913,3.2501,0.2928,0.5334289276136457,False,304,,,304,719.0
insomnia_ukb,Insomnia,sleep / brain-direct,Cluster415,415,Splat_415,Splatter,NEUR,GABA VGLUT2,"Hypothalamus: 78.7%, Midbrain: 7.6%, Thalamus: 3.7%","Human HTHpo-HTHso: 30.8%, Human HTHso-HTHtub: 26.6%, Human HTHtub: 7.5%","AVP, ECEL1, ARHGAP36, C14orf39, HMX3, ISL1, SIX6, DIRAS3, PMCH, ZCCHC12",16327,2.5123,0.0041736,4.6424,0.2942,0.5313573316084886,False,305,,,415,25816.0
insomnia_ukb,Insomnia,sleep / brain-direct,Cluster452,452,Thex_452,Thalamic excitatory,,VGLUT2,"Thalamus: 98.9%, Midbrain: 1.1%, Amygdala: 0.0%","Human LG: 73.7%, Human VPL: 7.2%, Human MG: 6.6%","PVALB, ST8SIA6-AS1, PPP1R17, RGS16, SHOX2, TGFBR2, DEFB1, CASQ2, ITM2A, ST8SIA6",16327,1.8459,0.0041396,3.4242,0.29492,0.5302957747689391,False,306,,,452,5044.0
insomnia_ukb,Insomnia,sleep / brain-direct,Cluster87,87,DLNP_87,Deep-layer near-projecting,NEUR,VGLUT1 VGLUT2,"Cerebral cortex: 83.9%, Basal forebrain: 12.2%, Hypothalamus: 2.8%","Human ACC: 25.8%, Human A25: 14.5%, Human FI: 11.5%","IFNG-AS1, NPSR1-AS1, LINC02218, MROH2A, NPSR1, AC244502.1, SLC9C1, CDCP1, PIWIL1, ERG",16327,2.2448,0.0042249,4.1923,0.29618,0.5284442712128364,False,307,,,87,1203.0
insomnia_ukb,Insomnia,sleep / brain-direct,Cluster119,119,CA13_119,Hippocampal CA1-3,NEUR,VGLUT1,"Hippocampus: 97.3%, Amygdala: 1.5%, Cerebral cortex: 1.3%","Human CA1: 27.4%, Human CA2U-CA3U: 17.2%, Human CA1-2R: 16.5%","LINC00607, ADAM2, AC012668.3, ATP6V1C2, AL138694.1, AL356807.1, GFRA1, CLPSL1, AC092661.1, FEZF2",16327,1.8561,0.0043721,3.5182,0.2989,0.5244740849607193,False,308,,,119,6827.0
insomnia_ukb,Insomnia,sleep / brain-direct,Cluster170,170,Misc_170,Miscellaneous,NEUR,VGLUT1 VGLUT2,"Hippocampus: 68.6%, Hypothalamus: 21.7%, Cerebral cortex: 6.4%","Human CA1: 57.7%, Human HTHtub: 21.5%, Human CA1U-CA2U-CA3U: 9.3%","LINC02752, POSTN, DCN, ITPRID1, LINC02309, LINC02316, AC124290.1, GRB14, IFNG-AS1, MAFA",16327,2.6498,0.004047,5.1511,0.30349,0.5178556143625895,False,309,,,170,503.0
insomnia_ukb,Insomnia,sleep / brain-direct,Cluster164,164,Misc_164,Miscellaneous,NEUR,VGLUT1 VGLUT2,"Cerebral cortex: 66.8%, Amygdala: 18.2%, Hippocampus: 15.0%","Human LEC: 42.3%, Human Pir: 23.8%, Human Sub: 15.0%","TMEM45B, LINC02752, LINC02105, BARX2, AC005482.1, DSC3, COL6A2, LINC01482, LINC02653, HMCN2",16327,1.9908,0.0038173,3.9161,0.3056,0.5148466500963477,False,310,,,164,659.0
insomnia_ukb,Insomnia,sleep / brain-direct,Cluster222,222,EMSN_222,Eccentric medium spiny neuron,NEUR,GABA,"Basal forebrain: 93.9%, Thalamus: 1.9%, Cerebral cortex: 1.8%","Human Pu: 38.7%, Human CaB: 28.3%, Human NAC: 12.1%","AL445584.2, CASZ1, AC022133.2, LINC01735, TAC1, LOXHD1, C6orf141, PENK, FBXL21P, SLC35D3",16327,2.1606,0.0039327,4.3103,0.3081,0.5113083016830594,False,311,,,222,2826.0
insomnia_ukb,Insomnia,sleep / brain-direct,Cluster226,226,EMSN_226,Eccentric medium spiny neuron,NEUR,GABA,"Basal forebrain: 33.6%, Amygdala: 33.3%, Hypothalamus: 19.3%","Human SI: 25.6%, Human BNST: 15.8%, Human HTHpo: 14.4%","NPFFR2, OTOF, GDNF-AS1, PDYN, ZNF736P9Y, DRD1, LINC01550, FBXL21P, AC034226.1, GFRA1",16327,2.8225,0.0038964,5.6829,0.30971,0.5090447717994767,False,312,,,226,5927.0
insomnia_ukb,Insomnia,sleep / brain-direct,Cluster247,247,MGE_247,MGE interneuron,NEUR,GABA,"Hippocampus: 91.0%, Amygdala: 4.8%, Cerebral cortex: 3.4%","Human CA1C-CA3C: 20.3%, Human CA1U-CA2U-CA3U: 19.1%, Human CA1: 16.6%","AC022133.2, AC022126.1, AL450345.2, KCNJ5, TNFSF15, LINC02624, MYHAS, ZAP70, LINC02192, FAM89A",16327,2.46,0.0038267,5.073,0.31387,0.5032501926054421,False,313,,,247,1110.0
insomnia_ukb,Insomnia,sleep / brain-direct,Cluster113,113,L5ET_113,Miscellaneous,NEUR,VGLUT1,"Cerebral cortex: 100.0%, Amygdala: 0.0%, Hippocampus: 0.0%","Human M1C: 73.3%, Human S1C: 14.1%, Human A43: 8.9%","AC005100.1, LINC02424, AC105213.1, LINC00922, OR51E2, ERG, NAALADL2-AS2, AC128707.1, LINC02008, LINC00943",16327,1.4722,0.0036996,3.081,0.31638,0.4997909782848922,False,314,,,113,630.0
insomnia_ukb,Insomnia,sleep / brain-direct,Cluster205,205,DG_205,Hippocampal dentate gyrus,NEUR,VGLUT1,"Hippocampus: 96.5%, Midbrain: 3.4%, Thalamus: 0.0%","Human DGU-CA4Upy: 74.0%, Human CA1U-CA2U-CA3U: 17.4%, Human SN: 3.4%","AC097528.1, AC097487.1, LINC01697, AJ006995.1, AC079772.1, LINC02237, LINC02030, GRP, AC021088.1, LINC01324",16327,2.2205,0.0037917,4.6568,0.31675,0.4992833764445211,False,315,,,205,5813.0
insomnia_ukb,Insomnia,sleep / brain-direct,Cluster151,151,DLIT_151,Deep-layer intratelencephalic,NEUR,VGLUT1 VGLUT2 VGLUT3,"Cerebral cortex: 44.8%, Amygdala: 33.6%, Basal forebrain: 21.4%","Human Cla: 20.0%, Human CEN: 18.2%, Human Pir: 10.5%","SMYD1, AC073225.1, AL136119.1, AL512452.1, ATP10A, NTNG2, CCN4, SMIM32, THEMIS, STPG2-AS1",16327,1.9206,0.0036874,4.0556,0.31791,0.4976958109448883,False,316,,,151,18750.0
insomnia_ukb,Insomnia,sleep / brain-direct,Cluster62,62,Astro_62,Astrocyte,ASTRO,,"Basal forebrain: 40.2%, Cerebellum: 19.3%, Midbrain: 16.2%","Human GPi: 30.1%, Human CbDN: 18.1%, Human SN: 10.1%","TNC, ANGPTL4, AC012405.1, GFAP, CPAMD8, AC073941.1, SLC14A1, GJA1, AL627316.1, CD44",16327,0.97796,0.0037589,2.0794,0.31907,0.4961140276678014,False,317,,,62,24821.0
insomnia_ukb,Insomnia,sleep / brain-direct,Cluster198,198,CA4_198,Hippocampal CA4,NEUR,VGLUT1 VGLUT2,"Hippocampus: 89.9%, Midbrain: 10.1%, Cerebral cortex: 0.0%","Human CA4C-DGC: 45.1%, Human DGR-CA4Rpy: 21.8%, Human DGR-CA4: 15.3%","MORC1, IGF2BP2, KREMEN2, ARL6IP1P3, AC006487.1, AP001978.1, LINC02720, AC021594.2, ABCA13, AC019127.1",16327,1.7893,0.0034005,4.0192,0.3281,0.4839937696139523,False,318,,,198,417.0
insomnia_ukb,Insomnia,sleep / brain-direct,Cluster21,21,Per_21,Vascular,PER,,"Thalamus: 28.3%, Pons: 17.9%, Basal forebrain: 9.8%","Human LG: 8.0%, Human Pul: 7.0%, Human PnEN: 6.7%","IFITM2, CARMN, MUSTN1, NOTCH3, GGT5, IFITM3, SLC6A12, MYL9, BGN, ITIH5",16327,0.52554,0.0032206,1.1869,0.32896,0.4828569070208371,False,319,,,21,1753.0
insomnia_ukb,Insomnia,sleep / brain-direct,Cluster206,206,MSN_206,Medium spiny neuron,NEUR,,"Hippocampus: 97.1%, Thalamus: 2.3%, Cerebral cortex: 0.6%","Human CA4C-DGC: 96.5%, Human Pul: 1.7%, Human LG: 0.6%","LINC02137, AC015631.1, GLI3, PLEK, AP003121.1, LINC02462, RGS9, MME, PTPN7, AL445584.2",16327,1.6825,0.00339,3.8621,0.33155,0.4794509677519723,False,320,,,206,172.0
insomnia_ukb,Insomnia,sleep / brain-direct,Cluster142,142,DLIT_142,Deep-layer intratelencephalic,NEUR,VGLUT1,"Cerebral cortex: 96.0%, Hippocampus: 1.3%, Basal forebrain: 1.2%","Human M1C: 26.9%, Human MTG: 11.3%, Human S1C: 4.8%","AC099517.1, Z68323.1, ADTRP, AC060765.2, AC021594.2, AL022724.3, AL359636.2, AL391117.1, AC008127.1, ALPL",16327,1.3955,0.0028051,3.2248,0.33261,0.47806469775169935,False,321,,,142,14326.0
insomnia_ukb,Insomnia,sleep / brain-direct,Cluster433,433,Midi_433,Midbrain-derived inhibitory,NEUR,GABA,"Midbrain: 89.4%, Thalamus: 8.3%, Hypothalamus: 1.3%","Human SC: 51.7%, Human PTR: 13.8%, Human IC: 9.1%","OTX2, LINC01210, OTX2-AS1, AL137100.3, AL161757.4, CHODL, PRSS12, AL109761.1, GALR1, SOX14",16327,1.4999,0.0030208,3.7951,0.34635,0.4604848080271424,False,322,,,433,1351.0
insomnia_ukb,Insomnia,sleep / brain-direct,Cluster44,44,Oligo_44,Oligodendrocyte,OLIGO,,"Thalamus: 20.9%, Pons: 19.2%, Midbrain: 19.1%","Human SN: 10.9%, Human PnRF: 6.9%, Human CbDN: 5.8%","AC004690.2, SLC5A11, ITGA2, AL033523.1, LINC02882, MOG, FOLH1, CARNS1, LINC01949, LRP2",16327,0.89463,0.0030226,2.2781,0.34727,0.45933273294955757,False,323,,,44,101039.0
insomnia_ukb,Insomnia,sleep / brain-direct,Cluster412,412,Splat_412,Splatter,NEUR,GABA HDC VGLUT2,"Hypothalamus: 97.4%, Midbrain: 2.2%, Thalamus: 0.3%","Human MN: 45.2%, Human HTHma-HTHtub: 26.3%, Human HTHtub: 14.1%","PMCH, AC022433.1, ISL1, TBX3, AC010478.1, C14orf39, AC026765.3, GAL, VWA5B1, RADX",16327,1.2208,0.0031516,3.1224,0.34791,0.45853308811816657,False,324,,,412,5062.0
insomnia_ukb,Insomnia,sleep / brain-direct,Cluster127,127,ULIT_127,Upper-layer intratelencephalic,NEUR,VGLUT1 VGLUT2,"Cerebral cortex: 90.2%, Basal forebrain: 4.2%, Amygdala: 3.4%","Human A38: 10.6%, Human ACC: 9.3%, Human FI: 9.0%","ADGRF5, AC018697.1, CARM1P1, AC124290.1, AL162493.1, AJ009632.2, AC124290.2, AC092848.2, AC117453.1, AC115100.1",16327,1.4258,0.0028717,3.9011,0.35738,0.44686975550322594,False,325,,,127,10430.0
insomnia_ukb,Insomnia,sleep / brain-direct,Cluster153,153,Amex_153,Amygdala excitatory,NEUR,VGLUT1 VGLUT2,"Amygdala: 93.4%, Hippocampus: 5.3%, Cerebral cortex: 1.3%","Human BL: 77.7%, Human La: 9.7%, Human CA1U-CA2U-CA3U: 5.3%","LINC02770, DCSTAMP, AC005909.2, AC068112.1, LINC01903, AL445207.1, AC022655.1, TG, PPP1R1C, LINC02073",16327,1.471,0.0026677,4.117,0.36043,0.4431790681585085,False,326,,,153,2227.0
insomnia_ukb,Insomnia,sleep / brain-direct,Cluster414,414,Splat_414,Splatter,NEUR,VGLUT2,"Hypothalamus: 90.6%, Midbrain: 8.5%, Thalamus: 0.8%","Human HTHma-HTHtub: 43.2%, Human MN: 14.9%, Human HTHma: 13.8%","SIM1, OTP, METTL11B, EBF3, LINC02505, AL110292.1, STK32B, LHX5-AS1, AL132857.1, AL158013.1",16327,1.1208,0.0026909,3.1648,0.36162,0.4417475581484448,False,327,,,414,2915.0
insomnia_ukb,Insomnia,sleep / brain-direct,Cluster408,408,Amex_408,Amygdala excitatory,NEUR,VGLUT1 VGLUT2,"Cerebral cortex: 82.2%, Amygdala: 13.3%, Hypothalamus: 4.4%","Human AON: 77.8%, Human CoA: 8.9%, Human Pir: 4.4%","EOMES, RXFP2, CDHR1, CARTPT, LINC01866, LINC01965, SHISA3, LGR6, AKAIN1, LINC01621",16327,0.81757,0.002423,2.3983,0.3666,0.4358075393738022,False,328,,,408,45.0
insomnia_ukb,Insomnia,sleep / brain-direct,Cluster281,281,CGE_281,CGE interneuron,NEUR,GABA,"Cerebral cortex: 70.5%, Amygdala: 13.0%, Hippocampus: 10.6%","Human Pir: 5.7%, Human MEC: 4.6%, Human M1C: 4.5%","HTR3A, AC004862.1, AL139090.1, HGFAC, AL391832.4, CHRNA6, EDNRA, AC006305.1, CHRNB3, TNFAIP8L3",16327,1.4381,0.0026643,4.2572,0.36775,0.43444731860043223,False,329,,,281,2234.0
insomnia_ukb,Insomnia,sleep / brain-direct,Cluster244,244,MGE_244,MGE interneuron,NEUR,GABA,"Cerebral cortex: 77.4%, Amygdala: 13.7%, Hippocampus: 6.5%","Human MEC: 5.8%, Human MTG: 5.5%, Human LEC: 5.4%","NPY, SST, AC011586.2, LINC01687, ELFN1, MSR1, MCUB, ADAMTS12, CORT, TAC3",16327,1.6963,0.0025334,5.1606,0.3712,0.4303920324531756,False,330,,,244,1172.0
insomnia_ukb,Insomnia,sleep / brain-direct,Cluster196,196,CA4_196,Hippocampal CA4,NEUR,VGLUT1,"Hippocampus: 99.9%, Midbrain: 0.1%, Cerebral cortex: 0.0%","Human CA4C-DGC: 55.3%, Human DGR-CA4Rpy: 39.4%, Human DGR-CA4: 3.0%","MORC1, ABCA13, LINC02196, GUCA1C, ITGA4, LATS2, TSPAN18, MYPN, AC021594.2, AC127526.2",16327,1.2966,0.0023434,4.2606,0.38045,0.4197024115634298,False,331,,,196,1360.0
insomnia_ukb,Insomnia,sleep / brain-direct,Cluster172,172,Amex_172,Amygdala excitatory,NEUR,VGLUT1 VGLUT2,"Cerebral cortex: 90.6%, Hippocampus: 8.8%, Amygdala: 0.6%","Human MEC: 81.6%, Human Sub: 8.8%, Human LEC: 8.6%","TGFBI, AC116345.1, AL391117.1, S100Z, AOX1, CRHR2, LINC01886, FBXL21P, AC092162.2, PLEKHG4B",16327,1.4413,0.0023978,4.7752,0.38139,0.4186306982898933,False,332,,,172,8592.0
insomnia_ukb,Insomnia,sleep / brain-direct,Cluster207,207,MSN_207,Medium spiny neuron,NEUR,GABA,"Basal forebrain: 92.9%, Thalamus: 4.1%, Amygdala: 1.9%","Human Pu: 54.1%, Human CaB: 28.2%, Human GPe: 5.8%","GPR6, AL139379.1, DRD2, AC073325.1, ADORA2A, LINC02137, PENK, GPR88, AL450332.1, LPL",16327,1.2776,0.0022751,4.5281,0.38892,0.4101397229201652,False,333,,,207,20569.0
insomnia_ukb,Insomnia,sleep / brain-direct,Cluster180,180,CA13_180,Hippocampal CA1-3,NEUR,VGLUT1,"Hippocampus: 99.6%, Cerebral cortex: 0.4%, Amygdala: 0.0%","Human CA1C-CA3C: 79.0%, Human CA4C-DGC: 17.2%, Human CA1R-CA2R-CA3R: 2.0%","AP001636.3, FNDC1, RUFY4, FIBCD1, CTXND1, BHLHE22, AC004160.1, GLYATL1, PTTG1, CABP7",16327,0.9865,0.0022508,3.5313,0.38999,0.40894652887221555,False,334,,,180,14007.0
insomnia_ukb,Insomnia,sleep / brain-direct,Cluster193,193,CA4_193,Hippocampal CA4,NEUR,VGLUT1,"Hippocampus: 98.3%, Amygdala: 0.9%, Cerebral cortex: 0.5%","Human CA4C-DGC: 76.9%, Human CA1C-CA3C: 12.5%, Human DGR-CA4Rpy: 4.3%","SCGN, MORC1, LINC02237, AL450311.1, ITGA4, C16orf74, HLX-AS1, GUCA1C, TSPAN18, AC127526.2",16327,1.1729,0.0021295,4.2098,0.39027,0.40863483159143027,False,335,,,193,1343.0
insomnia_ukb,Insomnia,sleep / brain-direct,Cluster413,413,Splat_413,Splatter,NEUR,VGLUT2,"Hypothalamus: 92.1%, Midbrain: 5.8%, Pons: 1.4%","Human MN: 38.6%, Human HTHma-HTHtub: 21.6%, Human HTHma: 18.2%","SIM1, PITX2, EBF3, AL158013.1, LHX1-DT, NTS, LHX1, ADGRG4, PANCR, FOXB1",16327,0.90616,0.0020623,3.2704,0.39086,0.4079787723105161,False,336,,,413,4634.0
insomnia_ukb,Insomnia,sleep / brain-direct,Cluster199,199,DG_199,Hippocampal dentate gyrus,NEUR,VGLUT1,"Hippocampus: 96.8%, Thalamus: 3.2%, Cerebral cortex: 0.0%","Human CA4C-DGC: 50.3%, Human DGR-CA4Rpy: 22.4%, Human CA1R-CA2R-CA3R: 16.8%","AJ006995.1, LINC01697, AC112721.2, CR382285.1, POSTN, CHRNA1, AQP9, LINC01338, TARID, LINC02237",16327,0.7739,0.0019789,3.0252,0.39905,0.39897268485551457,False,337,,,199,1365.0
insomnia_ukb,Insomnia,sleep / brain-direct,Cluster191,191,CA4_191,Hippocampal CA4,NEUR,VGLUT1,"Hippocampus: 98.1%, Cerebral cortex: 1.6%, Midbrain: 0.2%","Human CA4C-DGC: 41.8%, Human CA3R: 41.8%, Human CA1C-CA3C: 8.8%","AC021594.2, LINC02237, ITGA4, OR7E14P, LATS2, COL6A3, AC068985.1, AL450311.1, KCNG2, PTGFR",16327,0.96603,0.0019572,3.818,0.40013,0.3977988858966281,False,338,,,191,486.0
