t2d_xue2018,T2D,metabolic / body-mediated,Cluster247,247,MGE_247,MGE interneuron,NEUR,GABA,"Hippocampus: 91.0%, Amygdala: 4.8%, Cerebral cortex: 3.4%","Human CA1C-CA3C: 20.3%, Human CA1U-CA2U-CA3U: 19.1%, Human CA1: 16.6%","AC022133.2, AC022126.1, AL450345.2, KCNJ5, TNFSF15, LINC02624, MYHAS, ZAP70, LINC02192, FAM89A",15742,4.1454,0.006499,5.9286,0.24221,0.6158079303293608,False,206,,,247,1110.0
t2d_xue2018,T2D,metabolic / body-mediated,Cluster256,256,MGE_256,MGE interneuron,NEUR,GABA VGLUT3,"Cerebral cortex: 68.6%, Hippocampus: 21.8%, Basal forebrain: 5.0%","Human M1C: 8.3%, Human Sub: 6.3%, Human CA1U-CA2U-CA3U: 6.0%","WNT16, AC046195.2, MEPE, MYBPC1, AC006364.1, SRPK3, CPED1, AC106865.1, LHX6, AC022905.1",15742,4.395,0.0065795,6.2935,0.24249,0.6153061664817866,False,207,,,256,5526.0
t2d_xue2018,T2D,metabolic / body-mediated,Cluster80,80,Chrp_80,Choroid plexus,CHRP,,"Basal forebrain: 94.8%, Medulla: 4.5%, Hippocampus: 0.4%","Human SEP: 94.8%, Human MoAN: 3.0%, Human MoSR: 0.9%","AC016152.1, TRPV4, AC004052.1, CLIC6, SLC5A5, ABCA4, LINC00880, NWD1, AP003500.1, LMX1A",15742,1.4219,0.0062738,2.0475,0.2437,0.6131444708152757,False,208,,,80,1347.0
t2d_xue2018,T2D,metabolic / body-mediated,Cluster171,171,Amex_171,Amygdala excitatory,NEUR,VGLUT1 VGLUT2,"Hippocampus: 93.7%, Amygdala: 5.7%, Cerebral cortex: 0.3%","Human CA1: 86.7%, Human Sub: 6.9%, Human CMN: 5.7%","SERPINB13, TGFBI, AOX1, AC116345.1, ABCA12, LINC01886, AC082650.2, AOX3P, AC068305.2, CRHR2",15742,3.0294,0.0063945,4.3946,0.24531,0.6102847475282319,False,209,,,171,332.0
t2d_xue2018,T2D,metabolic / body-mediated,Cluster21,21,Per_21,Vascular,PER,,"Thalamus: 28.3%, Pons: 17.9%, Basal forebrain: 9.8%","Human LG: 8.0%, Human Pul: 7.0%, Human PnEN: 6.7%","IFITM2, CARMN, MUSTN1, NOTCH3, GGT5, IFITM3, SLC6A12, MYL9, BGN, ITIH5",15742,1.0498,0.006353,1.5267,0.24586,0.6093121227144894,False,210,,,21,1753.0
t2d_xue2018,T2D,metabolic / body-mediated,Cluster342,342,Splat_342,Splatter,NEUR,VGLUT2,"Cerebellum: 97.0%, Pons: 1.8%, Midbrain: 0.8%","Human CbDN: 97.0%, Human PnAN: 1.0%, Human PB: 0.6%","ASAH2, VENTXP1, AF130359.1, LTBP2, LINC01036, AC090993.1, AC007614.1, LINC01524, DIAPH3, AC087855.2",15742,2.4882,0.0067777,3.6282,0.24643,0.6083064229630909,False,211,,,342,868.0
t2d_xue2018,T2D,metabolic / body-mediated,Cluster49,49,Oligo_49,Oligodendrocyte,OLIGO,,"Pons: 30.3%, Midbrain: 20.2%, Medulla: 12.2%","Human PnRF: 10.0%, Human SN: 7.6%, Human CbDN: 7.3%","MBOAT1, AC110809.1, AC008945.2, S100A1, AC114485.1, AC007106.2, LINC01445, LINC01549, AC004690.2, S100B",15742,1.8418,0.0063215,2.6937,0.24708,0.6071624073343438,False,212,,,49,84282.0
t2d_xue2018,T2D,metabolic / body-mediated,Cluster178,178,Misc_178,Miscellaneous,NEUR,VGLUT1 VGLUT2,"Hippocampus: 43.8%, Midbrain: 29.4%, Cerebral cortex: 26.8%","Human Sub: 37.9%, Human SC: 29.4%, Human TH-TL: 21.6%","AC008662.1, AC091096.1, AP003066.1, AL391117.1, COBLL1, AC099517.1, AC097528.1, LINC02143, AC008415.1, AC004052.1",15742,4.0245,0.0062474,5.8976,0.2475,0.6064247967304125,False,213,,,178,691.0
t2d_xue2018,T2D,metabolic / body-mediated,Cluster108,108,DLCT6b_108,Deep-layer corticothalamic and 6b,NEUR,VGLUT1,"Cerebral cortex: 89.4%, Hippocampus: 6.0%, Basal forebrain: 2.1%","Human M1C: 19.4%, Human A29-A30: 16.6%, Human A44-A45: 5.6%","LINC02699, AC105021.1, LINC02726, SH2D1B, IL4R, SEMA3E, LINC02718, AC046195.1, VWA2, TMC3",15742,4.7854,0.0061803,7.1736,0.25237,0.5979622722837483,False,214,,,108,9206.0
t2d_xue2018,T2D,metabolic / body-mediated,Cluster92,92,DLNP_92,Deep-layer near-projecting,NEUR,VGLUT1,"Cerebral cortex: 94.7%, Hippocampus: 2.5%, Basal forebrain: 2.2%","Human MTG: 12.1%, Human Ig: 8.6%, Human A1C: 6.9%","CD200R1L, ERG, IFNG-AS1, NPSR1-AS1, BARX2, LINC02042, AC009081.2, AC129807.1, CD200R1L-AS1, CCDC80",15742,4.0003,0.0063722,6.0542,0.2544,0.5944828930236237,False,215,,,92,2119.0
t2d_xue2018,T2D,metabolic / body-mediated,Cluster46,46,Oligo_46,Oligodendrocyte,OLIGO,,"Thalamus: 22.7%, Midbrain: 19.9%, Cerebral cortex: 13.7%","Human SN-RN: 9.7%, Human SN: 6.7%, Human CbDN: 5.9%","CNDP1, LINC01608, OPALIN, RNASE1, LINC01792, NKX6-2, MAG, PPP1R14A, CD9, TMEM98",15742,1.7551,0.005958,2.6913,0.25716,0.5897965829105465,False,216,,,46,60616.0
t2d_xue2018,T2D,metabolic / body-mediated,Cluster455,455,Thex_455,Thalamic excitatory,NEUR,VGLUT2,"Thalamus: 97.9%, Midbrain: 2.1%, Cerebral cortex: 0.0%","Human Pul: 40.5%, Human ETH: 38.2%, Human MD: 5.5%","AC037486.1, LINC01151, SMILR, MATN3, FSHR, COL6A5, CYP27C1, CLEC3A, ITIH5, AC012535.1",15742,2.8001,0.0056001,4.4249,0.26344,0.5793182822961486,False,217,,,455,474.0
t2d_xue2018,T2D,metabolic / body-mediated,Cluster452,452,Thex_452,Thalamic excitatory,,VGLUT2,"Thalamus: 98.9%, Midbrain: 1.1%, Amygdala: 0.0%","Human LG: 73.7%, Human VPL: 7.2%, Human MG: 6.6%","PVALB, ST8SIA6-AS1, PPP1R17, RGS16, SHOX2, TGFBR2, DEFB1, CASQ2, ITM2A, ST8SIA6",15742,2.414,0.0054374,3.9043,0.2682,0.5715412264844199,False,218,,,452,5044.0
t2d_xue2018,T2D,metabolic / body-mediated,Cluster76,76,Chrp_76,Choroid plexus,CHRP EPEN OLIGO,,"Basal forebrain: 55.4%, Medulla: 31.7%, Thalamus: 8.9%","Human SEP: 55.4%, Human MoSR: 23.8%, Human Pul: 7.9%","TTR, AC004052.1, CLIC6, AC016152.1, LINC00880, TRPV4, LMX1A, NWD1, C1QTNF5, ABCA4",15742,1.3255,0.005648,2.1605,0.26977,0.5690063480624522,False,219,,,76,101.0
t2d_xue2018,T2D,metabolic / body-mediated,Cluster400,400,Splat_400,Splatter,NEUR,CHOL VGLUT3,"Basal forebrain: 54.0%, Amygdala: 22.9%, Hypothalamus: 14.7%","Human SI: 18.9%, Human BNST: 13.9%, Human HTHpo: 11.7%","SLC5A7, LHX8, CHAT, NTRK1, ECEL1, ISL1, AC091576.1, INSRR, OR8A1, CNBD1",15742,1.9096,0.0059584,3.132,0.27104,0.5669666113493871,False,220,,,400,769.0
t2d_xue2018,T2D,metabolic / body-mediated,Cluster271,271,LLC_271,LAMP5-LHX6 and Chandelier,NEUR,GABA,"Cerebral cortex: 63.9%, Amygdala: 16.6%, Hippocampus: 9.9%","Human MEC: 11.6%, Human LEC: 5.7%, Human CEN: 4.6%","LINC01344, SFRP1, ANO1, CHRDL1, EYA4, HAPLN1, ADGRG6, AL136456.1, MYB, CASP4LP",15742,3.9619,0.0056823,6.6601,0.27597,0.5591381264224534,False,221,,,271,4045.0
t2d_xue2018,T2D,metabolic / body-mediated,Cluster440,440,Midi_440,Midbrain-derived inhibitory,NEUR,GABA,"Thalamus: 87.1%, Midbrain: 10.2%, Pons: 1.9%","Human ETH: 15.2%, Human Pul: 11.7%, Human MD: 10.5%","AC008163.1, OTX2-AS1, DMBX1, AL161757.4, OTX2, AL137100.3, LINC01210, CASR, GATA3, SOX14",15742,3.6139,0.0056648,6.1805,0.27937,0.5538202322017199,False,222,,,440,7366.0
t2d_xue2018,T2D,metabolic / body-mediated,Cluster352,352,Splat_352,Splatter,,GABA,"Midbrain: 97.3%, Pons: 0.9%, Medulla: 0.8%","Human SC: 81.8%, Human IC: 10.4%, Human PAG-DR: 2.7%","LHX1, EBF1, EBF3, GATA3, TRAC, GATA3-AS1, PVALB, HAS2-AS1, HAS2, LHX1-DT",15742,3.3631,0.0055538,5.7816,0.28039,0.5522374793725074,False,223,,,352,862.0
t2d_xue2018,T2D,metabolic / body-mediated,Cluster249,249,MGE_249,MGE interneuron,NEUR,GABA,"Cerebral cortex: 61.8%, Hippocampus: 23.3%, Amygdala: 10.2%","Human MEC: 10.2%, Human LEC: 7.8%, Human CA1C-CA3C: 6.1%","SCARA5, SST, ELFN1, DCN, ITGA1, PAWR, FAM89A, TNFSF15, MCUB, CRHBP",15742,4.032,0.0053589,6.9456,0.28079,0.5516183631453396,False,224,,,249,5821.0
t2d_xue2018,T2D,metabolic / body-mediated,Cluster127,127,ULIT_127,Upper-layer intratelencephalic,NEUR,VGLUT1 VGLUT2,"Cerebral cortex: 90.2%, Basal forebrain: 4.2%, Amygdala: 3.4%","Human A38: 10.6%, Human ACC: 9.3%, Human FI: 9.0%","ADGRF5, AC018697.1, CARM1P1, AC124290.1, AL162493.1, AJ009632.2, AC124290.2, AC092848.2, AC117453.1, AC115100.1",15742,2.7327,0.0055346,4.7125,0.281,0.5512936800949201,False,225,,,127,10430.0
t2d_xue2018,T2D,metabolic / body-mediated,Cluster82,82,Chrp_82,Choroid plexus,CHRP,,"Basal forebrain: 76.6%, Medulla: 22.2%, Pons: 1.2%","Human SEP: 76.6%, Human MoAN: 11.7%, Human MoSR: 10.5%","TRPV4, CLIC6, AC012078.2, LINC00113, LMX1A, SLC28A3, SLC5A5, FBP2, LINC00880, RBM47",15742,1.0421,0.0054521,1.8014,0.28148,0.5505524576446422,False,226,,,82,171.0
t2d_xue2018,T2D,metabolic / body-mediated,Cluster434,434,Midi_434,Midbrain-derived inhibitory,NEUR,GABA,"Thalamus: 89.3%, Midbrain: 8.9%, Pons: 1.3%","Human VLN: 16.5%, Human LG: 15.2%, Human LP: 14.1%","NPSR1, CASR, LINC01210, OTX2, AL161757.4, SOX14, DMBX1, AL137100.3, NPPC, AL133493.1",15742,3.0914,0.0054112,5.363,0.28217,0.549489161832692,False,227,,,434,8469.0
t2d_xue2018,T2D,metabolic / body-mediated,Cluster329,329,Mmb_329,Mammillary body,NEUR,HDC VGLUT2,"Hypothalamus: 99.7%, Midbrain: 0.3%, Thalamus: 0.1%","Human HTHma-HTHtub: 33.4%, Human HTHtub: 25.8%, Human MN: 23.5%","SIM1, AL691420.1, FOXB1, PITX2, AC244258.1, LHX1-DT, ADGRL4, DAPL1, ANXA3, AC093912.1",15742,3.6028,0.0054939,6.2553,0.28233,0.54924297186293,False,228,,,329,1487.0
t2d_xue2018,T2D,metabolic / body-mediated,Cluster218,218,MSN_218,Medium spiny neuron,NEUR,,"Basal forebrain: 50.9%, Amygdala: 22.3%, Hypothalamus: 18.5%","Human SI: 38.1%, Human BNST: 19.5%, Human HTHpo: 16.2%","AC093515.1, AC079052.1, AC022433.1, ISL1, AC010478.1, DRD3, RXFP2, GDNF-AS1, AC006972.1, COL1A1",15742,3.301,0.0052617,5.8809,0.2873,0.5416643740080526,False,229,,,218,6712.0
t2d_xue2018,T2D,metabolic / body-mediated,Cluster38,38,COP_38,Committed oligodendrocyte precursor,OLIGO,,"Hippocampus: 29.9%, Cerebral cortex: 29.5%, Pons: 7.8%","Human CA1: 8.9%, Human A35r: 6.5%, Human PnEN: 5.6%","GPR17, AC008080.4, FRG2DP, AL512308.1, MDFI, LINC01447, TNS3, BCAS1, ADAM33, MIR503HG",15742,1.5538,0.0052795,2.7703,0.28744,0.541452795803407,False,230,,,38,779.0
t2d_xue2018,T2D,metabolic / body-mediated,Cluster75,75,COP_75,Committed oligodendrocyte precursor,CHRP EPEN NEUR,,"Medulla: 38.6%, Basal forebrain: 32.9%, Thalamus: 15.7%","Human SEP: 32.9%, Human MoSR: 21.4%, Human Pul: 12.9%","TTR, FOLR1, SOD3, IGFBP7, FBLN1, C1QTNF5, FBP2, ECRG4, CLIC6, SLC39A12",15742,1.3856,0.00505,2.4843,0.28852,0.5398240764819715,False,231,,,75,70.0
t2d_xue2018,T2D,metabolic / body-mediated,Cluster392,392,Splat_392,Splatter,NEUR,GABA,"Amygdala: 39.6%, Basal forebrain: 32.7%, Hypothalamus: 21.2%","Human BNST: 24.0%, Human SI: 17.5%, Human HTHpo: 11.4%","LHX8, GBX1, FGF10-AS1, FGF10, STAC, LHX6, DIAPH3, ELFN1, LINC00886, ASAH2",15742,3.5627,0.0052484,6.4009,0.28891,0.5392374257236213,False,232,,,392,2659.0
t2d_xue2018,T2D,metabolic / body-mediated,Cluster348,348,Splat_348,Splatter,NEUR,GLY,"Medulla: 65.6%, Spinal cord: 26.9%, Pons: 6.0%","Human MoAN: 39.0%, Human SpC: 26.9%, Human MoSR: 19.3%","HOXB3, PAX2, GBX1, HOXD3, GPC3, PAX8, NPPC, HOXB7, SLC6A5, SALL3",15742,2.2101,0.00613,3.9733,0.28903,0.539057077111041,False,233,,,348,1861.0
t2d_xue2018,T2D,metabolic / body-mediated,Cluster447,447,Thex_447,Thalamic excitatory,,VGLUT2,"Thalamus: 100.0%, Cerebral cortex: 0.0%, Amygdala: 0.0%","Human LG: 98.6%, Human Pul: 0.6%, Human VPL: 0.2%","SHOX2, PVALB, CHRNA2, AL355612.1, DEFB1, AP001605.1, DCDC2C, PPP1R17, TGFBR2, LINC01695",15742,2.5519,0.0050374,4.7369,0.29504,0.5301191006264646,False,234,,,447,2924.0
t2d_xue2018,T2D,metabolic / body-mediated,Cluster445,445,Thex_445,Thalamic excitatory,,VGLUT2,"Thalamus: 99.3%, Hippocampus: 0.7%, Cerebral cortex: 0.0%","Human LG: 98.5%, Human MG: 0.7%, Human DGR-CA4Rpy: 0.7%","LINC01491, AL355612.1, DCDC2C, AC092078.3, LCP1, SHOX2, CHRNA2, FZD10-AS1, VEGFC, DEFB1",15742,1.8792,0.0051729,3.499,0.29561,0.5292808785608355,False,235,,,445,134.0
t2d_xue2018,T2D,metabolic / body-mediated,Cluster449,449,Thex_449,Thalamic excitatory,,VGLUT2,"Thalamus: 98.7%, Amygdala: 1.0%, Midbrain: 0.3%","Human LP: 53.9%, Human ANC: 23.2%, Human Pul: 7.5%","CASQ2, RGS16, AC105213.1, MATN3, FAM20A, SHOX2, TAFA4, NTS, IRAG1, VANGL1",15742,2.5644,0.0048952,4.7791,0.29578,0.5290311953942038,False,236,,,449,3539.0
t2d_xue2018,T2D,metabolic / body-mediated,Cluster145,145,DLIT_145,Deep-layer intratelencephalic,NEUR,VGLUT1 VGLUT2,"Cerebral cortex: 65.1%, Hippocampus: 19.6%, Amygdala: 15.0%","Human MEC: 29.7%, Human LEC: 27.4%, Human Sub: 15.1%","AC079163.2, ONECUT1, AC016987.1, LINC02237, TWIST1, LINC01320, DCN, AGBL1, MYBPC1, CLEC19A",15742,2.9227,0.0048907,5.6674,0.30303,0.5185143741725865,False,237,,,145,4953.0
t2d_xue2018,T2D,metabolic / body-mediated,Cluster153,153,Amex_153,Amygdala excitatory,NEUR,VGLUT1 VGLUT2,"Amygdala: 93.4%, Hippocampus: 5.3%, Cerebral cortex: 1.3%","Human BL: 77.7%, Human La: 9.7%, Human CA1U-CA2U-CA3U: 5.3%","LINC02770, DCSTAMP, AC005909.2, AC068112.1, LINC01903, AL445207.1, AC022655.1, TG, PPP1R1C, LINC02073",15742,2.5505,0.0046653,4.9712,0.30396,0.5171835641618272,False,238,,,153,2227.0
t2d_xue2018,T2D,metabolic / body-mediated,Cluster358,358,Splat_358,Splatter,NEUR,GABA,"Midbrain: 91.5%, Thalamus: 7.8%, Pons: 0.4%","Human SC: 30.4%, Human PTR: 26.0%, Human PAG: 14.0%","TFAP2B, PAX3, GATA3, LINC01497, PAX7, AC005208.1, TFAP2A, LHX5-AS1, GATA3-AS1, AC025946.1",15742,3.4832,0.004746,6.8092,0.30449,0.5164269658098688,False,239,,,358,3175.0
t2d_xue2018,T2D,metabolic / body-mediated,Cluster135,135,ULIT_135,Upper-layer intratelencephalic,NEUR,VGLUT1 VGLUT2,"Cerebral cortex: 95.4%, Basal forebrain: 2.7%, Hippocampus: 1.0%","Human M1C: 10.7%, Human A1C: 7.5%, Human MTG: 6.2%","LINC01915, COL22A1, AL353811.1, LINC01164, IZUMO3, AL157769.1, LINC01781, ITGA11, TWIST2, AC008459.1",15742,2.2561,0.0044985,4.438,0.3056,0.5148466500963477,False,240,,,135,28248.0
t2d_xue2018,T2D,metabolic / body-mediated,Cluster3,3,Mono_3,Miscellaneous,MONO,,"Thalamus: 21.9%, Pons: 16.1%, Basal forebrain: 13.9%","Human PnEN: 8.9%, Human MoAN: 6.6%, Human PnRF: 3.8%","FCN1, CLEC12A, S100A4, TNFRSF1B, IFI30, LYZ, CYTIP, FGR, LILRB2, KYNU",15742,0.32744,0.0048799,0.64731,0.30649,0.5135836908541076,False,241,,,3,503.0
t2d_xue2018,T2D,metabolic / body-mediated,Cluster436,436,Midi_436,Midbrain-derived inhibitory,NEUR,GABA,"Thalamus: 82.2%, Midbrain: 17.5%, Hypothalamus: 0.1%","Human LG: 28.3%, Human Pul: 26.3%, Human SC: 7.5%","HMCN1, LINC01210, OTX2, SOX14, DMBX1, AC246817.2, OTX2-AS1, AC245123.1, AL133493.1, AC007159.1",15742,2.777,0.0047242,5.5191,0.30743,0.5122537549275593,False,242,,,436,13890.0
t2d_xue2018,T2D,metabolic / body-mediated,Cluster121,121,ULIT_121,Upper-layer intratelencephalic,NEUR,VGLUT1 VGLUT2,"Cerebral cortex: 91.7%, Amygdala: 3.9%, Basal forebrain: 2.7%","Human A38: 13.5%, Human TH-TL: 11.4%, Human MTG: 9.6%","MUC19, LINC01331, GLP2R, AL136985.3, TTC6, AC009878.2, LINC02248, AC011287.2, LINC01622, AL353604.1",15742,2.9063,0.0045915,5.791,0.30789,0.5116044163756126,False,243,,,121,36308.0
t2d_xue2018,T2D,metabolic / body-mediated,Cluster273,273,LLC_273,LAMP5-LHX6 and Chandelier,NEUR,GABA,"Amygdala: 44.9%, Cerebral cortex: 33.4%, Hippocampus: 7.3%","Human BL: 11.5%, Human CEN: 9.9%, Human CMN: 9.0%","LINC01344, SFRP1, HAPLN1, CHRDL1, EYA4, ANO1, ADGRG6, TMEM255A, MYB, CHST9",15742,3.6134,0.0048609,7.22,0.30838,0.5109137958976496,False,244,,,273,3254.0
t2d_xue2018,T2D,metabolic / body-mediated,Cluster328,328,Mmb_328,Mammillary body,NEUR,HDC VGLUT2,"Hypothalamus: 100.0%, Cerebral cortex: 0.0%, Amygdala: 0.0%","Human MN: 40.4%, Human HTHma: 29.5%, Human HTHtub: 26.0%","LINC00410, PITX2, AL691420.1, SIM1, LHX1-DT, FOXB1, AC087664.2, TNFRSF11B, LHX1, FSHR",15742,2.6806,0.0045712,5.3628,0.30859,0.5106181515560392,False,245,,,328,2346.0
t2d_xue2018,T2D,metabolic / body-mediated,Cluster343,343,Splat_343,Splatter,NEUR,VGLUT2,"Medulla: 57.2%, Spinal cord: 34.1%, Pons: 5.9%","Human MoAN: 47.7%, Human SpC: 34.1%, Human MoSR: 9.2%","EBF2, DRGX, LMX1B, EBF1, MAFA, EBF3, HOXB7, HOXB3, AC024230.1, HOXD3",15742,1.749,0.0050869,3.5008,0.30868,0.5104915084220839,False,246,,,343,2797.0
t2d_xue2018,T2D,metabolic / body-mediated,Cluster442,442,Midi_442,Midbrain-derived inhibitory,NEUR,GABA,"Thalamus: 99.1%, Midbrain: 0.8%, Pons: 0.1%","Human Pul: 22.3%, Human MD: 18.2%, Human LP: 13.8%","AL137100.3, CASR, AL161757.4, OTX2-AS1, OTX2, DMBX1, TSPAN12, LINC01210, NPSR1, VASH2",15742,2.757,0.004703,5.6068,0.31146,0.5065977207375071,False,247,,,442,7951.0
t2d_xue2018,T2D,metabolic / body-mediated,Cluster448,448,Thex_448,Thalamic excitatory,NEUR,VGLUT2,"Thalamus: 99.7%, Amygdala: 0.3%, Basal forebrain: 0.0%","Human VLN: 59.6%, Human CM-Pf: 18.2%, Human LP: 13.2%","CASQ2, AC093298.2, GDNF, CHRNA2, AL033530.1, FAM20A, TAFA4, MATN3, ST8SIA6, COL4A4",15742,1.7069,0.0048216,3.4746,0.31163,0.5063607403213377,False,248,,,448,5500.0
t2d_xue2018,T2D,metabolic / body-mediated,Cluster268,268,LLC_268,LAMP5-LHX6 and Chandelier,NEUR,GABA,"Hippocampus: 95.5%, Cerebral cortex: 2.4%, Amygdala: 1.1%","Human CA1U-CA2U-CA3U: 17.8%, Human CA3R: 17.6%, Human CA4C-DGC: 13.9%","CHRDL1, AL136456.1, EYA4, HAPLN1, LINC01344, CHST9, ANO1, TACR1, GRPR, NPPC",15742,3.1878,0.0046769,6.4908,0.31167,0.5063049990112143,False,249,,,268,3843.0
t2d_xue2018,T2D,metabolic / body-mediated,Cluster304,304,CBI_304,Cerebellar inhibitory,,GABA,"Cerebellum: 95.5%, Pons: 2.4%, Medulla: 1.8%","Human CBV: 87.2%, Human CBL: 8.3%, Human PnAN: 1.4%","SCGN, TFAP2B, LMCD1, LIPG, AL162718.1, CLCNKA, LRRC38, TFAP2A, BHLHE22, AC010476.2",15742,1.8001,0.0043543,3.7068,0.31362,0.5035962495186058,False,250,,,304,719.0
t2d_xue2018,T2D,metabolic / body-mediated,Cluster257,257,MGE_257,MGE interneuron,NEUR,GABA,"Cerebral cortex: 73.5%, Hippocampus: 19.7%, Amygdala: 3.5%","Human M1C: 9.5%, Human MTG: 5.2%, Human CA1U-CA2U-CA3U: 4.6%","MEPE, WNT16, MTND6P22, RGS5, HGF, RNF144B, AC006974.2, AC006364.1, LHX6, CPED1",15742,3.4436,0.0045631,7.1659,0.31542,0.5011107725979311,False,251,,,257,12242.0
t2d_xue2018,T2D,metabolic / body-mediated,Cluster78,78,Chrp_78,Choroid plexus,CHRP,,"Basal forebrain: 92.5%, Medulla: 6.3%, Thalamus: 0.6%","Human SEP: 92.5%, Human MoAN: 4.9%, Human MoSR: 1.2%","AC004052.1, TRPV4, AC016152.1, LINC00880, CLIC6, NWD1, AP003500.1, LMX1A, ABCA4, SLC39A12",15742,0.97427,0.0043351,2.0479,0.31714,0.49874897814414254,False,252,,,78,2653.0
t2d_xue2018,T2D,metabolic / body-mediated,Cluster137,137,DLIT_137,Deep-layer intratelencephalic,NEUR,VGLUT1 VGLUT2,"Cerebral cortex: 94.4%, Basal forebrain: 2.1%, Hippocampus: 1.9%","Human MTG: 7.5%, Human A13: 5.6%, Human M1C: 4.6%","LINC02196, AC099517.1, AC079380.1, AC073578.2, ADGRL4, PKD2L1, AC021134.1, AL450352.1, TRIM22, ARHGAP15",15742,2.7064,0.0043662,5.7753,0.31968,0.49528453345411166,False,253,,,137,17737.0
t2d_xue2018,T2D,metabolic / body-mediated,Cluster443,443,Midi_443,Midbrain-derived inhibitory,NEUR,GABA,"Thalamus: 98.3%, Midbrain: 1.6%, Pons: 0.1%","Human Pul: 26.6%, Human MD: 14.7%, Human LP: 13.7%","CASR, LINC01210, OTX2-AS1, OTX2, AL133493.1, AL161757.4, AL137100.3, NPPC, DMBX1, SOX14",15742,2.2318,0.004196,5.1145,0.33129,0.4797916731140085,False,254,,,443,14414.0
t2d_xue2018,T2D,metabolic / body-mediated,Cluster428,428,Splat_428,Splatter,NEUR,GABA,"Basal forebrain: 59.7%, Amygdala: 16.1%, Hypothalamus: 13.8%","Human SEP: 55.1%, Human BNST: 12.4%, Human ANC: 5.7%","FREM2, AC092958.2, SCGN, AC092957.1, ZIC2, LHX8, PRDM12, PRDM16, ZIC5, TTR",15742,3.0424,0.0039338,7.1828,0.33595,0.4737253545742462,False,255,,,428,3182.0
t2d_xue2018,T2D,metabolic / body-mediated,Cluster95,95,DLNP_95,Deep-layer near-projecting,NEUR,VGLUT1,"Cerebral cortex: 89.0%, Basal forebrain: 7.0%, Hypothalamus: 3.3%","Human A25: 21.2%, Human ACC: 13.9%, Human AON: 12.5%","NPSR1-AS1, AC009081.2, ERG, CCDC80, HMGA2, MYOCD, PDLIM1, CD200R1L, FSHR, GNAT3",15742,2.0035,0.0038376,4.8524,0.33985,0.4687127257417195,False,256,,,95,1307.0
t2d_xue2018,T2D,metabolic / body-mediated,Cluster103,103,DLCT6b_103,Deep-layer corticothalamic and 6b,NEUR,VGLUT1,"Cerebral cortex: 62.0%, Hippocampus: 25.8%, Amygdala: 12.1%","Human MEC: 45.4%, Human LEC: 14.7%, Human CA1U-CA2U-CA3U: 11.3%","CCN2, AC092131.1, VWA2, GUCA1C, SLC15A5, ITPRID1, C12orf42, F2R, LINC01735, LINC02218",15742,1.7403,0.0037296,4.2541,0.34124,0.4669400667158855,False,257,,,103,1268.0
t2d_xue2018,T2D,metabolic / body-mediated,Cluster173,173,Amex_173,Amygdala excitatory,NEUR,VGLUT1 VGLUT2,"Hippocampus: 55.8%, Amygdala: 36.5%, Cerebral cortex: 7.7%","Human Sub: 55.8%, Human BM: 30.5%, Human CMN: 4.7%","AC116345.1, AC016766.1, MCOLN2, AC018742.1, S100Z, WDR63, LINC00578, LINC02296, ALKAL2, LINC02015",15742,1.7419,0.0036443,4.2917,0.34242,0.46544087706739823,False,258,,,173,233.0
t2d_xue2018,T2D,metabolic / body-mediated,Cluster316,316,LRL_316,Lower rhombic lip,NEUR,VGLUT1 VGLUT2,"Pons: 76.6%, Medulla: 22.0%, Midbrain: 0.6%","Human PnEN: 53.4%, Human MoAN: 10.7%, Human DTg: 8.7%","ADAMTS20, NTRK1, AL139351.3, INSRR, BARHL1, AC022239.1, AL359208.1, CDH23, IRX2, HOXD3",15742,1.4332,0.003883,3.5333,0.34251,0.46532674422580494,False,259,,,316,1939.0
t2d_xue2018,T2D,metabolic / body-mediated,Cluster437,437,Midi_437,Midbrain-derived inhibitory,NEUR,GABA,"Thalamus: 85.5%, Midbrain: 13.8%, Pons: 0.5%","Human Pul: 19.7%, Human ETH: 12.5%, Human MD: 11.9%","AC245123.1, OTX2-AS1, LINC01210, OTX2, AC245187.2, AC246817.2, DMBX1, AL133493.1, GATA3, CASR",15742,2.2218,0.0038239,5.482,0.34263,0.4651746137463079,False,260,,,437,6147.0
t2d_xue2018,T2D,metabolic / body-mediated,Cluster409,409,Splat_409,Splatter,NEUR,GABA,"Basal forebrain: 66.5%, Amygdala: 14.2%, Thalamus: 9.9%","Human CaB: 17.8%, Human SI: 13.0%, Human NAC: 11.5%","GLP1R, CRABP1, CER1, TAC3, AL096799.1, TRH, LINC02203, NANOS1, NPR3, CHRNA3",15742,1.2778,0.0035446,3.1919,0.34446,0.4628612027487371,False,261,,,409,6395.0
t2d_xue2018,T2D,metabolic / body-mediated,Cluster453,453,Thex_453,Thalamic excitatory,,VGLUT2,"Thalamus: 82.7%, Midbrain: 17.3%, Cerebral cortex: 0.0%","Human LG: 29.5%, Human MG: 24.7%, Human PTR: 14.4%","CARTPT, CASQ2, ST8SIA6-AS1, PLEKHG4B, RGS16, LEF1, PVALB, PPP1R17, CYP27C1, LINC00868",15742,1.6904,0.003695,4.2619,0.34583,0.4611373353266155,False,262,,,453,5556.0
t2d_xue2018,T2D,metabolic / body-mediated,Cluster141,141,DLIT_141,Deep-layer intratelencephalic,NEUR,VGLUT1 VGLUT2,"Cerebral cortex: 95.4%, Basal forebrain: 2.0%, Hippocampus: 1.4%","Human MTG: 7.9%, Human Ig: 6.0%, Human TF: 5.7%","AP003066.1, AC080079.2, BARX2, LINC01680, AL033539.2, AL353709.1, AL138927.1, AC073091.1, AC073091.2, TRABD2A",15742,2.4805,0.0035899,6.4009,0.34919,0.4569382019853809,False,263,,,141,9992.0
t2d_xue2018,T2D,metabolic / body-mediated,Cluster174,174,Amex_174,Amygdala excitatory,NEUR,VGLUT1 VGLUT2,"Cerebral cortex: 84.3%, Amygdala: 10.2%, Hippocampus: 5.2%","Human LEC: 47.8%, Human Pir: 27.5%, Human Sub: 5.2%","AC116345.1, P2RX2, AL031073.2, MS4A8, TMEM108-AS1, AL136441.1, AL136985.3, LINC02248, CARM1P1, SEMA3D",15742,2.084,0.0035671,5.4442,0.35094,0.4547671282530341,False,264,,,174,10364.0
t2d_xue2018,T2D,metabolic / body-mediated,Cluster91,91,DLNP_91,Deep-layer near-projecting,NEUR,VGLUT1,"Cerebral cortex: 89.4%, Basal forebrain: 4.7%, Hippocampus: 3.3%","Human MTG: 16.0%, Human Idg: 7.9%, Human TF: 7.8%","CD200R1L, NPSR1-AS1, IFNG-AS1, LINC02042, CCDC80, ERG, BARX2, CD200R1L-AS1, TRIM22, PDLIM1",15742,1.9959,0.003611,5.2415,0.35168,0.45385232925660346,False,265,,,91,1523.0
t2d_xue2018,T2D,metabolic / body-mediated,Cluster86,86,DLNP_86,Deep-layer near-projecting,NEUR,VGLUT1 VGLUT2,"Cerebral cortex: 97.0%, Basal forebrain: 1.8%, Hippocampus: 1.1%","Human M1C: 30.8%, Human S1C: 8.6%, Human Ig: 6.4%","IFNG-AS1, NPSR1-AS1, IL26, ROBO3, AC087863.2, LINC02444, SLC9C1, LINC02218, NPSR1, LINC01479",15742,2.1429,0.0035891,5.6585,0.35245,0.45290248509610637,False,266,,,86,1508.0
t2d_xue2018,T2D,metabolic / body-mediated,Cluster100,100,DLCT6b_100,Deep-layer corticothalamic and 6b,NEUR,VGLUT1,"Cerebral cortex: 63.0%, Amygdala: 27.0%, Basal forebrain: 5.9%","Human AON: 9.6%, Human CMN: 9.2%, Human CEN: 7.7%","SLC15A5, VWA2, SULF1, AC010511.1, AC023503.1, LINC01194, LGR6, CPZ, ADTRP, CCN2",15742,1.7562,0.0036893,4.6571,0.35305,0.4521637841692019,False,267,,,100,4900.0
t2d_xue2018,T2D,metabolic / body-mediated,Cluster407,407,Amex_407,Amygdala excitatory,NEUR,VGLUT2 VGLUT3,"Amygdala: 72.6%, Cerebral cortex: 23.5%, Hippocampus: 2.7%","Human CEN: 31.1%, Human CMN: 27.2%, Human A35-A36: 18.1%","TFAP2C, PAPPA2, CARTPT, BARHL2, LINC01798, MEIS1-AS3, AC006065.4, LHX9, GALR1, POU2F3",15742,2.6754,0.0034134,7.146,0.35406,0.4509231349773572,False,268,,,407,2370.0
t2d_xue2018,T2D,metabolic / body-mediated,Cluster356,356,Splat_356,Splatter,NEUR,GABA,"Midbrain: 67.5%, Pons: 20.1%, Thalamus: 9.5%","Human PTR: 30.3%, Human IC: 11.1%, Human SC: 8.1%","MECOM, COL8A1, GATA3, LHX5-AS1, AC005100.1, GATA3-AS1, LMO1, EBF3, GATA2, TFAP2A",15742,2.6496,0.0034582,7.1342,0.35517,0.4495637247197098,False,269,,,356,6063.0
t2d_xue2018,T2D,metabolic / body-mediated,Cluster2,2,Nkcell_2,Miscellaneous,NK,,"Thalamus: 17.6%, Cerebral cortex: 15.5%, Basal forebrain: 14.8%","Human GPe: 5.7%, Human GPi: 5.5%, Human CbDN: 5.1%","NKG7, GNLY, PRF1, KLRF1, PYHIN1, CCL4, RUNX3, CST7, GZMA, GZMB",15742,0.22108,0.003415,0.60144,0.35659,0.4478308400886338,False,270,,,2,671.0
t2d_xue2018,T2D,metabolic / body-mediated,Cluster83,83,DLNP_83,Deep-layer near-projecting,NEUR,VGLUT1,"Cerebral cortex: 92.0%, Basal forebrain: 3.2%, Hypothalamus: 1.9%","Human M1C: 22.3%, Human S1C: 5.3%, Human MTG: 4.6%","AC022535.1, AL359313.1, AC044893.1, ERG, AL353072.2, MYH4, AC005909.2, NPSR1-AS1, ABCC9, LPO",15742,1.626,0.0032628,4.5569,0.36062,0.44295019095589716,False,271,,,83,476.0
t2d_xue2018,T2D,metabolic / body-mediated,Cluster81,81,Chrp_81,Choroid plexus,CHRP,,"Basal forebrain: 73.7%, Medulla: 25.6%, Pons: 0.6%","Human SEP: 73.7%, Human MoAN: 20.9%, Human MoSR: 3.9%","AC004052.1, TRPV4, AC016152.1, SLC5A5, CLIC6, ABCA4, LINC00880, NWD1, LMX1A, RBM47",15742,0.74896,0.0032608,2.1014,0.36077,0.4427695835917132,False,272,,,81,1375.0
t2d_xue2018,T2D,metabolic / body-mediated,Cluster109,109,DLCT6b_109,Deep-layer corticothalamic and 6b,NEUR,VGLUT1,"Cerebral cortex: 94.0%, Hippocampus: 3.3%, Basal forebrain: 1.8%","Human M1C: 16.5%, Human MTG: 9.8%, Human TH-TL: 5.7%","AC105021.1, AC073968.2, VWA2, IL4R, C5AR2, SEMA3E, SH2D1B, ABCC9, SGCG, ADAMTSL1",15742,2.4483,0.0033147,6.8705,0.36079,0.4427455082836576,False,273,,,109,10646.0
