trait_key,trait_display,trait_category,VARIABLE,cluster_id_numeric,cluster_name,supercluster,class_auto,neurotransmitter,top_regions,top_dissections,top_genes,NGENES,BETA,BETA_STD,SE,P,log10_neg_P,bonferroni_significant,rank_within_trait,independent,independent_rank,cluster_id,n_cells
t2d_xue2018,T2D,metabolic / body-mediated,Cluster33,33,OPC_33,Oligodendrocyte precursor,OPC,,"Pons: 23.8%, Midbrain: 22.9%, Thalamus: 19.2%","Human PnRF: 8.4%, Human CBV: 7.8%, Human SN-RN: 7.8%","BX284613.2, MROH9, FMO6P, PDGFRA, VCAN, FERMT1, AL512308.1, OLIG2, AC004852.2, COL9A1",15742,13.313,0.034307,3.7642,0.00020326,3.691948078757338,False,1,,,33,48139.0
t2d_xue2018,T2D,metabolic / body-mediated,Cluster133,133,ULIT_133,Upper-layer intratelencephalic,NEUR,VGLUT1 VGLUT2,"Cerebral cortex: 100.0%, Basal forebrain: 0.0%, Hypothalamus: 0.0%","Human V1C: 62.9%, Human V2: 17.6%, Human Pro: 14.7%","LINC02388, AC112770.1, AC092448.1, AC126182.3, VIPR2, TRPC3, AC020637.1, IGFBP2, SLC38A11, LINC02296",15742,24.817,0.031633,7.4214,0.00041425,3.3827374829086256,False,2,,,133,20086.0
t2d_xue2018,T2D,metabolic / body-mediated,Cluster206,206,MSN_206,Medium spiny neuron,NEUR,,"Hippocampus: 97.1%, Thalamus: 2.3%, Cerebral cortex: 0.6%","Human CA4C-DGC: 96.5%, Human Pul: 1.7%, Human LG: 0.6%","LINC02137, AC015631.1, GLI3, PLEK, AP003121.1, LINC02462, RGS9, MME, PTPN7, AL445584.2",15742,14.599,0.029478,4.5319,0.00063968,3.194037227561977,False,3,,,206,172.0
t2d_xue2018,T2D,metabolic / body-mediated,Cluster132,132,Misc_132,Miscellaneous,NEUR,VGLUT1 VGLUT2,"Cerebral cortex: 98.4%, Hippocampus: 0.8%, Midbrain: 0.8%","Human A29-A30: 90.9%, Human Pro: 5.1%, Human M1C: 1.2%","CD53, DPP4, AC060765.1, LINC01721, AC112770.1, AL157769.1, VIPR2, PCSK1, AC016687.2, QRFPR",15742,19.091,0.030174,5.9633,0.0006854,3.164055899906152,False,4,,,132,492.0
t2d_xue2018,T2D,metabolic / body-mediated,Cluster297,297,URL_297,Upper rhombic lip,,VGLUT1,"Midbrain: 97.1%, Thalamus: 2.9%, Cerebral cortex: 0.0%","Human SC: 73.5%, Human SN: 20.6%, Human PAG: 2.9%","TPH1, RBP3, AC004852.2, GABRR3, AQP3, NEUROG1, ETV3L, AC063980.1, CACNA2D4, ASB15-AS1",15742,3.0973,0.02793,0.9981,0.00095947,3.017968599915631,False,5,,,297,34.0
t2d_xue2018,T2D,metabolic / body-mediated,Cluster122,122,ULIT_122,Upper-layer intratelencephalic,NEUR,VGLUT1 VGLUT2,"Cerebral cortex: 93.9%, Basal forebrain: 2.6%, Hippocampus: 1.7%","Human MTG: 13.0%, Human Ig: 10.2%, Human TF: 8.4%","LINC01500, CASP4LP, LINC01484, AC097512.1, PDGFD, ART3, MUC19, AC093607.1, AC021613.1, AL353604.1",15742,22.041,0.02954,7.1232,0.00098888,3.004856406582581,False,6,,,122,29434.0
t2d_xue2018,T2D,metabolic / body-mediated,Cluster217,217,MSN_217,Medium spiny neuron,NEUR,GABA,"Amygdala: 69.5%, Basal forebrain: 15.7%, Hypothalamus: 7.4%","Human CEN: 36.4%, Human BNST: 21.2%, Human SI: 12.3%","DCDC2C, PENK, AC015631.1, SIX3, P2RY1, LINC02462, LINC01305, CALCR, CACNG5, LINC01833",15742,24.295,0.02936,7.9121,0.0010707,2.970332197324677,False,7,,,217,7260.0
t2d_xue2018,T2D,metabolic / body-mediated,Cluster123,123,ULIT_123,Upper-layer intratelencephalic,NEUR,VGLUT1,"Cerebral cortex: 99.2%, Hippocampus: 0.4%, Basal forebrain: 0.3%","Human A5-A7: 8.0%, Human V2: 7.9%, Human A40: 6.9%","LINC02263, AP001994.2, LINC02306, LINC00507, LINC00508, AC021613.1, ART3, AC110614.1, LINC01484, COL5A1",15742,21.815,0.028623,7.2136,0.0012493,2.903333260024618,False,8,,,123,55595.0
t2d_xue2018,T2D,metabolic / body-mediated,Cluster32,32,OPC_32,Oligodendrocyte precursor,OPC,,"Hypothalamus: 54.7%, Thalamus: 16.6%, Amygdala: 8.5%","Human MN: 54.6%, Human CM-Pf: 12.1%, Human CEN: 8.3%","MROH9, VCAN-AS1, FMO6P, FMO3, BX284613.2, AL512308.1, LHFPL3-AS1, Z94057.1, AC004852.2, LINC00402",15742,9.3833,0.027582,3.1725,0.0015527,2.80891244699545,False,9,,,32,929.0
t2d_xue2018,T2D,metabolic / body-mediated,Cluster228,228,EMSN_228,Eccentric medium spiny neuron,NEUR,GABA,"Amygdala: 83.7%, Cerebral cortex: 12.2%, Thalamus: 1.9%","Human La: 25.3%, Human BM: 17.5%, Human CEN: 16.1%","NPFFR2, AC087516.2, AC083837.1, AC008127.1, AL365255.1, AC097459.1, AC092590.1, EYA2, DBX2, SCN5A",15742,21.236,0.027127,7.3121,0.0018441,2.7342155321594803,False,10,,,228,3227.0
t2d_xue2018,T2D,metabolic / body-mediated,Cluster399,399,Splat_399,Splatter,NEUR,VGLUT2,"Medulla: 99.3%, Pons: 0.5%, Cerebral cortex: 0.1%","Human MoAN: 42.7%, Human MoRF-MoEN: 36.3%, Human MoSR: 20.3%","PHOX2B-AS1, PHOX2B, TFAP2B, C5orf58, NPFF, LINC00682, HOXB3, LMX1B, DBH, RP1",15742,7.8559,0.025752,2.7845,0.0023956,2.620585695587829,False,11,,,399,1007.0
t2d_xue2018,T2D,metabolic / body-mediated,Cluster34,34,OPC_34,Oligodendrocyte precursor,OPC,,"Hippocampus: 33.6%, Cerebral cortex: 30.9%, Amygdala: 16.5%","Human CA1: 11.7%, Human CEN: 8.5%, Human A35r: 6.4%","AC004852.2, AL512308.1, PDGFRA, BX284613.2, GPR17, VCAN, CSPG4, AC117464.1, OLIG2, FERMT1",15742,10.847,0.026794,3.8931,0.0026698,2.5735212712757565,False,12,,,34,31058.0
t2d_xue2018,T2D,metabolic / body-mediated,Cluster251,251,MGE_251,MGE interneuron,NEUR,GABA,"Cerebral cortex: 94.0%, Hippocampus: 2.5%, Basal forebrain: 2.4%","Human MTG: 6.6%, Human A29-A30: 5.6%, Human M1C: 4.6%","EDNRA, NMU, MAFB, CYP26A1, PNOC, PDCL2, KCNJ5, SST, TRBC2, ADGRG6",15742,15.578,0.024664,5.8992,0.0041419,2.382800390708731,False,13,,,251,16688.0
t2d_xue2018,T2D,metabolic / body-mediated,Cluster220,220,MSN_220,Medium spiny neuron,NEUR,GABA,"Amygdala: 91.6%, Thalamus: 8.4%, Cerebral cortex: 0.0%","Human CEN: 87.5%, Human VA: 6.4%, Human La: 2.6%","FAM9B, ISL1, AC010478.1, PTGDR, NPNT, EBF1, DRD1, MYO3A, LPL, GDNF-AS1",15742,15.809,0.024287,6.0952,0.0047539,2.3229499580527193,False,14,,,220,391.0
t2d_xue2018,T2D,metabolic / body-mediated,Cluster344,344,Splat_344,Splatter,CHRP NEUR,VGLUT2,"Medulla: 61.0%, Spinal cord: 21.9%, Pons: 14.9%","Human MoAN: 29.1%, Human SpC: 21.9%, Human MoRF-MoEN: 17.3%","LMX1B, EBF3, EBF1, PHOX2B-AS1, HOXB3, AC009411.2, EBF2, AC018742.1, PHOX2B, TLX3",15742,11.946,0.024862,4.7045,0.0055603,2.254901775894611,False,15,,,344,3736.0
t2d_xue2018,T2D,metabolic / body-mediated,Cluster290,290,CGE_290,CGE interneuron,NEUR,GABA,"Cerebral cortex: 83.0%, Hippocampus: 8.5%, Amygdala: 5.2%","Human MTG: 7.1%, Human M1C: 5.4%, Human A40: 3.9%","SHISA8, VIP, SCTR, FLT1, SLC22A3, KMO, PTHLH, GGT4P, CXCL12, LINC02488",15742,14.609,0.022673,5.9649,0.0071677,2.1446201801136637,False,16,,,290,20794.0
t2d_xue2018,T2D,metabolic / body-mediated,Cluster36,36,OPC_36,Oligodendrocyte precursor,OPC,,"Cerebral cortex: 33.7%, Thalamus: 12.5%, Midbrain: 11.5%","Human A35r: 20.8%, Human SpC: 8.0%, Human SN: 5.4%","AC004852.2, BX284613.2, PDGFRA, AL512308.1, VCAN, OLIG2, OLIG1, GPR17, CSPG4, FERMT1",15742,8.8208,0.02262,3.6261,0.0075023,2.1248055733845006,False,17,,,36,1643.0
t2d_xue2018,T2D,metabolic / body-mediated,Cluster229,229,EMSN_229,Eccentric medium spiny neuron,NEUR,GABA,"Amygdala: 56.1%, Basal forebrain: 28.8%, Cerebral cortex: 11.2%","Human CEN: 21.7%, Human CMN: 17.8%, Human Cla: 12.9%","NPFFR2, AC087516.2, CACNG5, EYA2, PDYN, ISM2, ZNF736P9Y, LINC00354, FOXP2, GPR88",15742,14.881,0.020838,6.48,0.010832,1.965291348658931,False,18,,,229,1857.0
t2d_xue2018,T2D,metabolic / body-mediated,Cluster408,408,Amex_408,Amygdala excitatory,NEUR,VGLUT1 VGLUT2,"Cerebral cortex: 82.2%, Amygdala: 13.3%, Hypothalamus: 4.4%","Human AON: 77.8%, Human CoA: 8.9%, Human Pir: 4.4%","EOMES, RXFP2, CDHR1, CARTPT, LINC01866, LINC01965, SHISA3, LGR6, AKAIN1, LINC01621",15742,6.8926,0.020376,3.0151,0.011135,1.953309778629943,False,19,,,408,45.0
t2d_xue2018,T2D,metabolic / body-mediated,Cluster212,212,MSN_212,Medium spiny neuron,NEUR,GABA,"Basal forebrain: 90.4%, Cerebral cortex: 3.6%, Amygdala: 3.6%","Human CaB: 25.4%, Human Pu: 22.3%, Human NAC: 18.4%","PENK, AL139379.1, GPR6, DRD2, AL450332.1, ADORA2A, AC107208.1, GPR88, AC092979.1, LINC02137",15742,11.251,0.020723,5.0207,0.012523,1.90229161941837,False,20,,,212,6867.0
t2d_xue2018,T2D,metabolic / body-mediated,Cluster225,225,EMSN_225,Eccentric medium spiny neuron,NEUR,GABA,"Amygdala: 47.2%, Basal forebrain: 33.3%, Cerebral cortex: 10.2%","Human SI: 15.2%, Human BNST: 14.1%, Human La: 12.0%","AC008786.1, ZNF736P9Y, LMNTD1, CASZ1, OTOF, S100Z, AC068633.1, DNAH8, CALCRL, MUC19",15742,13.42,0.021164,6.0029,0.012697,1.8962988804104857,False,21,,,225,2296.0
t2d_xue2018,T2D,metabolic / body-mediated,Cluster346,346,Splat_346,Splatter,NEUR,VGLUT2,"Medulla: 60.2%, Spinal cord: 39.4%, Pons: 0.3%","Human SpC: 39.4%, Human MoAN: 34.3%, Human MoSR: 22.4%","LMX1B, HOXB3, HOXD3, AL161908.1, POU4F1, EBF3, HOXB7, HSPD1P8, NHLH1, TAC3",15742,7.8058,0.023009,3.5167,0.013231,1.8784073305615931,False,22,,,346,635.0
t2d_xue2018,T2D,metabolic / body-mediated,Cluster202,202,DG_202,Hippocampal dentate gyrus,NEUR,VGLUT1,"Hippocampus: 100.0%, Cerebral cortex: 0.0%, Amygdala: 0.0%","Human DGR-CA4Rpy: 87.7%, Human CA1R-CA2R-CA3R: 12.3%","TTR, FOLR1, LINC01697, AC097528.1, AC097487.1, AL672167.1, NTF3, AL591518.1, TARID, AJ006995.1",15742,12.073,0.02013,5.482,0.013829,1.8592092233746977,False,23,,,202,398.0
t2d_xue2018,T2D,metabolic / body-mediated,Cluster223,223,EMSN_223,Eccentric medium spiny neuron,NEUR,GABA,"Basal forebrain: 74.1%, Amygdala: 12.2%, Thalamus: 9.6%","Human CaB: 31.8%, Human SEP: 12.3%, Human NAC: 10.9%","FRMD7, LINC01735, FBXL21P, CASZ1, AL445584.2, SCN5A, LECT2, CALCRL, AC022133.2, C6orf141",15742,11.017,0.019635,5.0029,0.013838,1.858926673732525,False,24,,,223,2239.0
t2d_xue2018,T2D,metabolic / body-mediated,Cluster242,242,MGE_242,MGE interneuron,NEUR,,"Cerebral cortex: 90.8%, Hippocampus: 4.6%, Basal forebrain: 1.8%","Human M1C: 6.8%, Human MTG: 6.4%, Human A32: 5.4%","AC022905.1, AC113347.4, MCUB, ELFN1, DCN, FBN2, SLC27A6, TNFSF15, SST, LINC02397",15742,16.009,0.020667,7.2773,0.013917,1.8564543727615779,False,25,,,242,15796.0
t2d_xue2018,T2D,metabolic / body-mediated,Cluster231,231,EMSN_231,Eccentric medium spiny neuron,NEUR,GABA,"Amygdala: 60.2%, Basal forebrain: 16.4%, Cerebral cortex: 13.7%","Human CMN: 15.9%, Human CEN: 12.8%, Human SI: 11.6%","LMNTD1, NPFFR2, AC012078.2, ZNF736P9Y, GABRQ, EYA2, PCDH11Y, CAPSL, DRAXIN, ITGA6",15742,15.226,0.020512,6.97,0.014473,1.839441437892442,False,26,,,231,2372.0
t2d_xue2018,T2D,metabolic / body-mediated,Cluster310,310,URL_310,Upper rhombic lip,NEUR,VGLUT1,"Cerebellum: 52.4%, Pons: 26.2%, Medulla: 15.1%","Human CBV: 34.8%, Human PnAN: 19.7%, Human CbDN: 13.1%","CBLN3, AC092957.1, CRTAM, AC021698.1, LINC01036, AC073225.1, LINC01798, SLC22A31, AC044798.3, AC020659.1",15742,8.3495,0.020738,3.8853,0.015828,1.8005739584060099,False,27,,,310,33405.0
t2d_xue2018,T2D,metabolic / body-mediated,Cluster57,57,Astro_57,Astrocyte,ASTRO,,"Hippocampus: 66.8%, Basal forebrain: 25.3%, Cerebral cortex: 4.0%","Human DGR-CA4Rpy: 26.6%, Human SEP: 21.1%, Human DGU-CA4Upy: 19.9%","CD38, OBI1-AS1, FGFR3, AL627316.1, AC012405.1, AL137139.2, TNC, LINC02649, GLI3, SLC14A1",15742,6.5121,0.019978,3.0327,0.015894,1.7987667913191254,False,28,,,57,6925.0
t2d_xue2018,T2D,metabolic / body-mediated,Cluster35,35,OPC_35,Oligodendrocyte precursor,OPC,,"Cerebral cortex: 62.3%, Hippocampus: 21.4%, Basal forebrain: 6.5%","Human A35r: 17.0%, Human Sub: 9.1%, Human MTG: 8.0%","AC004852.2, PDGFRA, GPNMB, GPR17, AL512308.1, OLIG2, COL20A1, CSPG4, OLIG1, AC117464.1",15742,8.3558,0.020633,3.9049,0.016195,1.7906190476538042,False,29,,,35,23965.0
t2d_xue2018,T2D,metabolic / body-mediated,Cluster341,341,Splat_341,Splatter,NEUR,VGLUT2,"Pons: 98.8%, Medulla: 1.2%, Cerebral cortex: 0.0%","Human DTg: 81.3%, Human PnEN: 11.1%, Human PnAN: 4.7%","EBF2, EBF3, AC079160.1, EBF1, DRGX, LINC01798, LINC01645, CNGA3, AC096719.1, LBX1-AS1",15742,8.9462,0.019457,4.2111,0.016828,1.7739674966550414,False,30,,,341,342.0
t2d_xue2018,T2D,metabolic / body-mediated,Cluster284,284,CGE_284,CGE interneuron,NEUR,GABA,"Cerebral cortex: 74.7%, Amygdala: 9.9%, Hippocampus: 9.3%","Human M1C: 5.9%, Human MEC: 5.8%, Human MTG: 4.9%","AC011990.1, PCDH18, CXCL14, LINC01931, KMO, PTGFR, LINC02397, AL136114.1, LINC02144, VIP",15742,13.686,0.019947,6.4908,0.017503,1.7568875072118342,False,31,,,284,9109.0
t2d_xue2018,T2D,metabolic / body-mediated,Cluster386,386,Splat_386,Splatter,NEUR,VGLUT2,"Medulla: 98.2%, Pons: 1.2%, Midbrain: 0.6%","Human MoRF-MoEN: 55.1%, Human MoSR: 38.9%, Human MoAN: 4.2%","TACR3, LINC01876, AC074099.1, HOXB3, HSPD1P8, POU4F1, PGR-AS1, PGR, LINC02742, HOXA3",15742,10.235,0.018715,4.9177,0.018718,1.7277405570597777,False,32,,,386,167.0
t2d_xue2018,T2D,metabolic / body-mediated,Cluster52,52,Astro_52,Astrocyte,ASTRO,,"Cerebral cortex: 90.3%, Hypothalamus: 3.9%, Hippocampus: 2.2%","Human MTG: 14.9%, Human STG: 7.9%, Human TH-TL: 6.2%","LINC01727, FGFR3, LINC00499, ZNF98, PRDM16-DT, F3, GJB6, PAPLN, GJA1, OAF",15742,5.6943,0.01943,2.7598,0.019554,1.7087643891512123,False,33,,,52,25484.0
t2d_xue2018,T2D,metabolic / body-mediated,Cluster311,311,URL_311,Upper rhombic lip,NEUR,VGLUT1,"Cerebellum: 72.7%, Medulla: 10.3%, Pons: 8.2%","Human CBV: 33.7%, Human CBL: 23.0%, Human CbDN: 16.1%","CBLN3, AC073225.1, AC092957.1, CRTAM, SLC22A31, CDH15, PRR35, LINC01798, FAT2, AC044798.3",15742,6.6255,0.019582,3.2175,0.019747,1.7044988738303768,False,34,,,311,97038.0
t2d_xue2018,T2D,metabolic / body-mediated,Cluster222,222,EMSN_222,Eccentric medium spiny neuron,NEUR,GABA,"Basal forebrain: 93.9%, Thalamus: 1.9%, Cerebral cortex: 1.8%","Human Pu: 38.7%, Human CaB: 28.3%, Human NAC: 12.1%","AL445584.2, CASZ1, AC022133.2, LINC01735, TAC1, LOXHD1, C6orf141, PENK, FBXL21P, SLC35D3",15742,10.148,0.018615,5.0093,0.0214,1.6695862266508092,False,35,,,222,2826.0
t2d_xue2018,T2D,metabolic / body-mediated,Cluster244,244,MGE_244,MGE interneuron,NEUR,GABA,"Cerebral cortex: 77.4%, Amygdala: 13.7%, Hippocampus: 6.5%","Human MEC: 5.8%, Human MTG: 5.5%, Human LEC: 5.4%","NPY, SST, AC011586.2, LINC01687, ELFN1, MSR1, MCUB, ADAMTS12, CORT, TAC3",15742,12.206,0.018419,6.0416,0.021685,1.6638405735152193,False,36,,,244,1172.0
t2d_xue2018,T2D,metabolic / body-mediated,Cluster239,239,MGE_239,MGE interneuron,NEUR,GABA,"Cerebral cortex: 95.4%, Hippocampus: 1.5%, Basal forebrain: 1.2%","Human M1C: 10.0%, Human MTG: 6.9%, Human A29-A30: 5.1%","AC022905.1, NMU, MAFB, SCARA5, PRDM1, TRBC2, MYO5B, PDCL2, BLM, PNOC",15742,14.157,0.019183,7.08,0.022782,1.6424081524765592,False,37,,,239,6114.0
t2d_xue2018,T2D,metabolic / body-mediated,Cluster243,243,MGE_243,MGE interneuron,NEUR,GABA,"Cerebral cortex: 96.3%, Hippocampus: 1.4%, Basal forebrain: 1.1%","Human MTG: 8.2%, Human A40: 5.9%, Human M1C: 4.5%","LINC01687, AC011586.2, AC113347.4, MSR1, HPGD, AC011586.1, CMTM8, SST, DCN, AOX1",15742,13.121,0.018977,6.5929,0.023296,1.6327186423670568,False,38,,,243,16126.0
t2d_xue2018,T2D,metabolic / body-mediated,Cluster209,209,MSN_209,Medium spiny neuron,NEUR,GABA,"Basal forebrain: 96.3%, Thalamus: 2.9%, Amygdala: 0.6%","Human CaB: 77.9%, Human Pu: 8.2%, Human NAC: 5.1%","AL450332.1, AL139379.1, LINC02137, AC004551.1, AC015631.1, LINC02462, AL445584.2, LPL, PLEK, CA12",15742,6.8776,0.016865,3.5057,0.024902,1.6037657712142002,False,39,,,209,11410.0
t2d_xue2018,T2D,metabolic / body-mediated,Cluster295,295,CGE_295,CGE interneuron,NEUR,GABA,"Cerebral cortex: 67.0%, Amygdala: 17.8%, Hippocampus: 8.6%","Human M1C: 5.2%, Human MEC: 5.2%, Human BL: 4.2%","VIP, EREG, CRH, AC013265.1, TAC3, SLC6A2, AC062021.1, AL391832.4, SP8, PTHLH",15742,10.541,0.018212,5.4709,0.027012,1.568443258951855,False,40,,,295,4922.0
t2d_xue2018,T2D,metabolic / body-mediated,Cluster293,293,CGE_293,CGE interneuron,NEUR,GABA,"Cerebral cortex: 70.3%, Hippocampus: 15.1%, Amygdala: 8.5%","Human MEC: 5.0%, Human MTG: 5.0%, Human M1C: 4.3%","VIP, PTHLH, TAC3, AC020930.1, IQGAP2, HS3ST3A1, AC013265.1, AL391832.4, LAMA3, SLC22A3",15742,11.512,0.017891,6.0561,0.028668,1.5426026042024974,False,41,,,293,20104.0
t2d_xue2018,T2D,metabolic / body-mediated,Cluster203,203,DG_203,Hippocampal dentate gyrus,NEUR,VGLUT1,"Hippocampus: 98.3%, Midbrain: 1.4%, Cerebral cortex: 0.2%","Human DGU-CA4Upy: 42.8%, Human DGR-CA4: 13.9%, Human DGR-CA4Rpy: 13.6%","AC097528.1, LINC02248, AC097487.1, AC092110.1, AC079772.1, AC009878.2, COL6A3, AL445985.1, GRP, AL161629.1",15742,10.519,0.017505,5.5529,0.029098,1.5361368604578587,False,42,,,203,8378.0
t2d_xue2018,T2D,metabolic / body-mediated,Cluster41,41,COP_41,Committed oligodendrocyte precursor,OLIGO,,"Amygdala: 24.7%, Hypothalamus: 23.3%, Basal forebrain: 20.2%","Human HTHso: 18.1%, Human La: 17.3%, Human GPe: 16.1%","OPALIN, LINC01608, CD22, CDH1, FA2H, LINC01099, LINC01792, MYRF, LINC00639, AC110285.1",15742,6.9226,0.01736,3.6663,0.029513,1.529986642169836,False,43,,,41,1310.0
t2d_xue2018,T2D,metabolic / body-mediated,Cluster207,207,MSN_207,Medium spiny neuron,NEUR,GABA,"Basal forebrain: 92.9%, Thalamus: 4.1%, Amygdala: 1.9%","Human Pu: 54.1%, Human CaB: 28.2%, Human GPe: 5.8%","GPR6, AL139379.1, DRD2, AC073325.1, ADORA2A, LINC02137, PENK, GPR88, AL450332.1, LPL",15742,9.6991,0.017336,5.1393,0.029575,1.529075246700032,False,44,,,207,20569.0
t2d_xue2018,T2D,metabolic / body-mediated,Cluster156,156,Amex_156,Amygdala excitatory,NEUR,VGLUT1 VGLUT2,"Amygdala: 78.4%, Hippocampus: 19.2%, Cerebral cortex: 2.3%","Human CMN: 38.0%, Human BL: 24.7%, Human CA1U-CA2U-CA3U: 16.5%","CAPN8, TACR3, TG, AC099565.1, CERS3-AS1, TRHR, AL392086.3, AL136985.3, AL136441.1, DSP",15742,11.938,0.017185,6.3742,0.030553,1.5149461399393145,False,45,,,156,5433.0
t2d_xue2018,T2D,metabolic / body-mediated,Cluster309,309,URL_309,Upper rhombic lip,NEUR,VGLUT1 VGLUT2,"Pons: 89.0%, Cerebellum: 8.6%, Medulla: 1.6%","Human PnEN: 37.8%, Human PnAN: 28.2%, Human PB: 12.3%","AC017037.5, AC108517.2, AC084740.1, LMX1A, ABCA13, AC092957.1, TMEM255B, CBLN1, CPLX4, AC080079.2",15742,8.7027,0.017686,4.6633,0.031019,1.5083722072149441,False,46,,,309,373.0
t2d_xue2018,T2D,metabolic / body-mediated,Cluster177,177,Misc_177,Miscellaneous,NEUR,VGLUT1 VGLUT2,"Hippocampus: 68.2%, Midbrain: 20.5%, Cerebral cortex: 10.8%","Human Sub: 39.5%, Human CA1-2R: 23.8%, Human SC: 20.4%","AC008662.1, AC097528.1, LINC01339, COBLL1, AC018680.1, VIPR2, AC091096.1, LINC01524, LINC02143, AL109930.1",15742,12.282,0.017283,6.5821,0.031036,1.5081342568039522,False,47,,,177,3941.0
t2d_xue2018,T2D,metabolic / body-mediated,Cluster294,294,CGE_294,CGE interneuron,NEUR,GABA,"Cerebral cortex: 64.4%, Hippocampus: 14.7%, Amygdala: 10.8%","Human MEC: 5.3%, Human M1C: 5.2%, Human Cla: 4.7%","VIP, ABI3BP, PTHLH, IQGAP2, TAC3, CRH, DLX1, AC104129.1, NPR3, LAMA3",15742,12.64,0.017557,6.8273,0.032065,1.493968755746742,False,48,,,294,14134.0
t2d_xue2018,T2D,metabolic / body-mediated,Cluster54,54,Astro_54,Astrocyte,ASTRO,,"Cerebral cortex: 38.8%, Hippocampus: 33.1%, Amygdala: 22.1%","Human A35r: 18.3%, Human CA1: 15.4%, Human Sub: 12.0%","ETNPPL, LINC00499, GLI3, OBI1-AS1, FGFR3, PAPLN, AC097518.2, GJA1, AL160272.2, RANBP3L",15742,5.7044,0.017211,3.101,0.032932,1.482381893260517,False,49,,,54,24168.0
t2d_xue2018,T2D,metabolic / body-mediated,Cluster221,221,MSN_221,Medium spiny neuron,NEUR,GABA,"Basal forebrain: 78.8%, Amygdala: 9.0%, Cerebral cortex: 6.5%","Human SI: 19.8%, Human Pu: 16.4%, Human NAC: 15.6%","AC048352.1, GPR6, LINC01305, DRD2, AC005482.1, RDH10, SIX3, LOXHD1, AC023905.1, AL392086.1",15742,9.103,0.016902,5.0388,0.035427,1.4506656226769554,False,50,,,221,2571.0
t2d_xue2018,T2D,metabolic / body-mediated,Cluster201,201,DG_201,Hippocampal dentate gyrus,NEUR,VGLUT1,"Hippocampus: 99.9%, Midbrain: 0.1%, Thalamus: 0.0%","Human DGU-CA4Upy: 34.3%, Human DGR-CA4: 34.3%, Human DGR-CA4Rpy: 14.6%","AC097487.1, AC097528.1, COL6A3, NTF3, LINC01697, ANKRD20A19P, AL672167.1, LINC01324, AC092110.1, AL445985.1",15742,10.872,0.016732,6.0567,0.036333,1.4396987411503608,False,51,,,201,18996.0
t2d_xue2018,T2D,metabolic / body-mediated,Cluster312,312,URL_312,Upper rhombic lip,NEUR,VGLUT1,"Medulla: 61.0%, Pons: 34.8%, Cerebellum: 3.6%","Human MoAN: 47.2%, Human PnAN: 33.2%, Human MoSR: 8.2%","TTR, CBLN3, AC073225.1, AC092957.1, MSR1, CRTAM, LINC01798, AL359208.1, AC044798.3, SLC22A31",15742,5.4647,0.017846,3.0552,0.036848,1.433586079379844,False,52,,,312,5392.0
t2d_xue2018,T2D,metabolic / body-mediated,Cluster340,340,Splat_340,Splatter,NEUR,VGLUT2,"Pons: 88.3%, Midbrain: 9.5%, Thalamus: 1.6%","Human PB: 67.1%, Human DTg: 14.6%, Human PnEN: 5.1%","PTH2, ONECUT1, LHX9, MAB21L2, PRDM6, AC016044.1, DLK1, LINC01798, C1QL1, ONECUT3",15742,7.401,0.016089,4.1776,0.038245,1.4174253347416887,False,53,,,340,547.0
t2d_xue2018,T2D,metabolic / body-mediated,Cluster426,426,EMSN_426,Eccentric medium spiny neuron,NEUR,GABA,"Amygdala: 81.9%, Cerebral cortex: 10.0%, Thalamus: 3.2%","Human CEN: 36.3%, Human CMN: 31.4%, Human BM: 8.7%","LINC01497, NPFFR2, DGKK, PAX6, SCN5A, EYA2, AL161629.1, LINC01305, NPNT, AL592156.1",15742,14.618,0.016242,8.2856,0.038857,1.4105307326538825,False,54,,,426,1600.0
t2d_xue2018,T2D,metabolic / body-mediated,Cluster335,335,Splat_335,Splatter,NEUR,VGLUT2,"Medulla: 78.3%, Pons: 15.9%, Midbrain: 4.8%","Human IO: 70.8%, Human PnRF: 13.5%, Human MoSR: 3.2%","HSPD1P8, AC092445.1, LINC00331, POU4F1, TES, HOXD3, AC096773.1, PDLIM1, AC093772.1, LINC00581",15742,6.1031,0.017118,3.4608,0.038922,1.4098048516861297,False,55,,,335,993.0
t2d_xue2018,T2D,metabolic / body-mediated,Cluster216,216,MSN_216,Medium spiny neuron,NEUR,GABA,"Basal forebrain: 40.9%, Amygdala: 26.3%, Hypothalamus: 18.3%","Human SI: 36.9%, Human BNST: 19.4%, Human HTHpo: 16.1%","DRD2, MYO3A, PENK, ADORA2A, LINC01833, GPR6, LINC02462, AL020994.2, P2RY1, SIX3",15742,11.01,0.016373,6.2649,0.039436,1.4041071420580515,False,56,,,216,5720.0
t2d_xue2018,T2D,metabolic / body-mediated,Cluster226,226,EMSN_226,Eccentric medium spiny neuron,NEUR,GABA,"Basal forebrain: 33.6%, Amygdala: 33.3%, Hypothalamus: 19.3%","Human SI: 25.6%, Human BNST: 15.8%, Human HTHpo: 14.4%","NPFFR2, OTOF, GDNF-AS1, PDYN, ZNF736P9Y, DRD1, LINC01550, FBXL21P, AC034226.1, GFRA1",15742,11.662,0.016244,6.6595,0.039973,1.3982332564295785,False,57,,,226,5927.0
t2d_xue2018,T2D,metabolic / body-mediated,Cluster370,370,Splat_370,Splatter,NEUR,VGLUT2,"Midbrain: 98.8%, Pons: 0.5%, Thalamus: 0.5%","Human SC: 76.1%, Human IC: 11.3%, Human PTR: 7.9%","EBF2, TFAP2B, EBF3, EBF1, LHX9, POU4F1, HSPD1P8, LEF1, TFAP2D, LGR5",15742,11.758,0.016357,6.7155,0.039997,1.3979725819796947,False,58,,,370,3622.0
t2d_xue2018,T2D,metabolic / body-mediated,Cluster224,224,EMSN_224,Eccentric medium spiny neuron,NEUR,GABA,"Basal forebrain: 70.9%, Amygdala: 13.6%, Cerebral cortex: 8.2%","Human SI: 29.8%, Human NAC: 26.6%, Human BNST: 13.0%","SLC35D3, CASZ1, AL590867.1, AC022133.2, FBXL21P, AC022126.1, DRD1, LECT2, C6orf141, RXRG",15742,11.502,0.016432,6.5738,0.040105,1.3968014793239028,False,59,,,224,4297.0
t2d_xue2018,T2D,metabolic / body-mediated,Cluster227,227,EMSN_227,Eccentric medium spiny neuron,NEUR,GABA,"Amygdala: 52.6%, Basal forebrain: 20.6%, Hypothalamus: 20.3%","Human CMN: 22.0%, Human SI: 19.2%, Human CEN: 13.6%","NPFFR2, FAM160A1, AC002072.1, NTS, FAM9B, NPNT, GDNF-AS1, RD3, WFS1, OTOF",15742,11.057,0.016274,6.3305,0.040365,1.3939950431805643,False,60,,,227,359.0
t2d_xue2018,T2D,metabolic / body-mediated,Cluster128,128,ULIT_128,Upper-layer intratelencephalic,NEUR,VGLUT1 VGLUT2,"Cerebral cortex: 99.9%, Hypothalamus: 0.0%, Basal forebrain: 0.0%","Human M1C: 73.1%, Human S1C: 17.9%, Human A32: 4.1%","AJ009632.2, MIR3976HG, LAMA2, TWIST1, VIPR2, AC087883.2, LINC02055, COL5A2, AL138694.1, SCTR",15742,11.459,0.01615,6.5649,0.040461,1.3929633877759153,False,61,,,128,10650.0
t2d_xue2018,T2D,metabolic / body-mediated,Cluster345,345,Splat_345,Splatter,NEUR,VGLUT2,"Medulla: 52.3%, Spinal cord: 35.4%, Midbrain: 6.8%","Human MoAN: 42.2%, Human SpC: 35.4%, Human MoSR: 9.3%","LMX1B, DRGX, SKOR2, HOXB7, HOXB3, EBF3, EBF2, EBF1, TLX3, HOXD3",15742,5.975,0.016853,3.4278,0.040672,1.3907044711260859,False,62,,,345,2720.0
t2d_xue2018,T2D,metabolic / body-mediated,Cluster37,37,COP_37,Committed oligodendrocyte precursor,OLIGO,,"Cerebral cortex: 35.6%, Hippocampus: 19.5%, Amygdala: 8.2%","Human A35r: 6.3%, Human CA1: 4.8%, Human MTG: 4.5%","GPR17, AL512308.1, TNS3, BCAS1, MIR503HG, AC008080.4, NKX2-2, GPNMB, INAVA, FIBIN",15742,5.3182,0.016827,3.0539,0.040814,1.389190839855539,False,63,,,37,796.0
t2d_xue2018,T2D,metabolic / body-mediated,Cluster208,208,MSN_208,Medium spiny neuron,NEUR,GABA,"Basal forebrain: 89.6%, Amygdala: 5.6%, Cerebral cortex: 3.5%","Human CaB: 31.1%, Human NAC: 28.8%, Human GPe: 12.5%","PENK, GPR6, ADORA2A, DRD2, LINC02137, AC004551.1, SMOC2, AC107208.1, LPL, EYA1",15742,9.1716,0.016112,5.2828,0.041284,1.3842182306209745,False,64,,,208,13170.0
t2d_xue2018,T2D,metabolic / body-mediated,Cluster155,155,Amex_155,Amygdala excitatory,NEUR,VGLUT1 VGLUT2,"Amygdala: 99.6%, Cerebral cortex: 0.2%, Hippocampus: 0.2%","Human La: 77.0%, Human BL: 17.2%, Human CEN: 5.2%","AC005909.2, LINC02770, AL445207.1, LINC01903, AC099517.1, AC022655.1, DCSTAMP, AC068112.1, LINC01821, AC115100.1",15742,11.867,0.015811,6.8771,0.042223,1.3744509127346909,False,65,,,155,11716.0
t2d_xue2018,T2D,metabolic / body-mediated,Cluster29,29,Fbl_29,Fibroblast,,,"Medulla: 41.3%, Spinal cord: 39.7%, Thalamus: 4.8%","Human SpC: 39.7%, Human IO: 25.4%, Human MoRF-MoEN: 7.9%","IGFBP6, VIM, BNC2, FLVCR2, IGF2, COL1A2, CFH, EBF2, CD177, KLF2",15742,2.1264,0.015739,1.2339,0.042421,1.3724190979749733,False,66,,,29,63.0
t2d_xue2018,T2D,metabolic / body-mediated,Cluster308,308,URL_308,Upper rhombic lip,,VGLUT1,"Cerebellum: 84.5%, Pons: 10.2%, Medulla: 3.6%","Human CBV: 77.8%, Human PnAN: 6.8%, Human CBL: 5.8%","AC017037.5, AC084740.1, EOMES, LMX1A, AL359208.1, CSRP2, AC092957.1, AC108517.2, MPP3, ITGBL1",15742,6.2145,0.016042,3.6137,0.042755,1.3690130892297798,False,67,,,308,920.0
t2d_xue2018,T2D,metabolic / body-mediated,Cluster250,250,MGE_250,MGE interneuron,NEUR,GABA,"Cerebral cortex: 92.5%, Hippocampus: 2.4%, Basal forebrain: 2.2%","Human MEC: 7.1%, Human M1C: 7.0%, Human MTG: 5.6%","PROM1, NMU, ADGRG6, AC022905.1, KCNJ5, MCUB, PAWR, SST, SCARA5, AC113347.4",15742,9.5232,0.016393,5.5379,0.042762,1.3689419908194027,False,68,,,250,16604.0
