t2d_xue2018,T2D,metabolic / body-mediated,Cluster193,193,CA4_193,Hippocampal CA4,NEUR,VGLUT1,"Hippocampus: 98.3%, Amygdala: 0.9%, Cerebral cortex: 0.5%","Human CA4C-DGC: 76.9%, Human CA1C-CA3C: 12.5%, Human DGR-CA4Rpy: 4.3%","SCGN, MORC1, LINC02237, AL450311.1, ITGA4, C16orf74, HLX-AS1, GUCA1C, TSPAN18, AC127526.2",15742,5.8067,0.010416,5.1194,0.12836,0.8915702915765336,False,137,,,193,1343.0
t2d_xue2018,T2D,metabolic / body-mediated,Cluster282,282,CGE_282,CGE interneuron,NEUR,GABA,"Cerebral cortex: 82.6%, Hippocampus: 11.9%, Amygdala: 2.2%","Human A32: 5.2%, Human MTG: 5.1%, Human M1C: 4.8%","AC004862.1, AC091576.1, ADAM33, CXCL14, NDNF, AL139090.1, AL391832.4, AC073316.1, ARHGAP36, AC068633.1",15742,5.1599,0.010131,4.598,0.1309,0.8830603534492443,False,138,,,282,10065.0
t2d_xue2018,T2D,metabolic / body-mediated,Cluster307,307,CBI_307,Cerebellar inhibitory,NEUR,GABA,"Cerebellum: 70.3%, Medulla: 12.1%, Pons: 11.7%","Human CBV: 58.9%, Human CBL: 10.0%, Human PnEN: 5.7%","SCGN, TFAP2B, LINC00492, TFAP2A, TPTE2P4, CLCNKA, LIPG, LRRC38, LINC02552, LBX1-AS1",15742,5.171,0.010267,4.6138,0.1312,0.8820661649603585,False,139,,,307,3020.0
t2d_xue2018,T2D,metabolic / body-mediated,Cluster422,422,Splat_422,Splatter,NEUR,GABA,"Hypothalamus: 44.2%, Amygdala: 23.2%, Thalamus: 20.2%","Human BNST: 22.3%, Human ANC: 20.1%, Human HTHpo: 19.8%","CALCR, LHX8, TMEM255A, DGKK, AL110292.1, ARHGAP36, GABRE, ONECUT3, STK26, LINC00540",15742,8.1156,0.010338,7.2475,0.13142,0.8813385371455034,False,140,,,422,2976.0
t2d_xue2018,T2D,metabolic / body-mediated,Cluster364,364,Splat_364,Splatter,NEUR,VGLUT2,"Midbrain: 99.6%, Thalamus: 0.2%, Medulla: 0.1%","Human IC: 97.5%, Human SC: 1.7%, Human PTR: 0.2%","TFAP2D, LHX9, LINC01956, HNF4G, TMEM176B, LINC01568, AL138720.1, IRX2, WDR72, ZFHX4-AS1",15742,5.9147,0.0099762,5.2838,0.1315,0.8810742471742233,False,141,,,364,7200.0
t2d_xue2018,T2D,metabolic / body-mediated,Cluster149,149,DLIT_149,Deep-layer intratelencephalic,NEUR,VGLUT1,"Cerebral cortex: 98.6%, Basal forebrain: 0.6%, Hippocampus: 0.5%","Human M1C: 24.6%, Human MTG: 8.2%, Human S1C: 6.3%","THEMIS, LINC00343, AL356432.3, SH2D1B, AC011754.1, AC099517.1, ISLR, MIR3976HG, AC079380.1, AL117329.1",15742,7.4511,0.010089,6.7241,0.13392,0.8731545593508152,False,142,,,149,31428.0
t2d_xue2018,T2D,metabolic / body-mediated,Cluster233,233,EMSN_233,Eccentric medium spiny neuron,NEUR,GABA,"Amygdala: 73.7%, Thalamus: 9.5%, Hypothalamus: 5.8%","Human La: 23.4%, Human CEN: 17.3%, Human BNST: 12.8%","ZNF736P9Y, NPFFR2, GABRQ, NMBR, LMNTD1, PRSS35, FRMD7, PCDH11Y, CAPSL, LINC00354",15742,7.6803,0.010315,6.9531,0.13468,0.8706968922839491,False,143,,,233,3128.0
t2d_xue2018,T2D,metabolic / body-mediated,Cluster446,446,Thex_446,Thalamic excitatory,,VGLUT2,"Thalamus: 99.9%, Hippocampus: 0.0%, Midbrain: 0.0%","Human LG: 99.9%, Human PAG-DR: 0.0%, Human LP: 0.0%","DCDC2C, AL355612.1, LINC01491, AC092078.3, SHOX2, AC044810.3, DEFB1, LCP1, AC092078.2, PPP1R17",15742,4.9251,0.010196,4.4812,0.13588,0.8668444618020097,False,144,,,446,15148.0
t2d_xue2018,T2D,metabolic / body-mediated,Cluster138,138,ULIT_138,Upper-layer intratelencephalic,NEUR,VGLUT1 VGLUT2,"Cerebral cortex: 96.4%, Basal forebrain: 1.2%, Hippocampus: 1.2%","Human MTG: 14.3%, Human V2: 5.2%, Human A19: 4.5%","AL450352.1, AC073578.2, AC112770.1, AC016687.2, LINC01721, AP003066.1, SCHLAP1, COBLL1, AL355672.1, VIPR2",15742,6.0487,0.010242,5.5407,0.1375,0.8616973018337185,False,145,,,138,58263.0
t2d_xue2018,T2D,metabolic / body-mediated,Cluster241,241,MGE_241,MGE interneuron,NEUR,GABA,"Cerebral cortex: 90.2%, Basal forebrain: 3.5%, Hippocampus: 2.5%","Human MTG: 6.3%, Human M1C: 5.3%, Human A43: 5.1%","AC011586.2, MSR1, AC022905.1, AC113347.4, MCOLN2, AC011586.1, CMTM8, MYO5B, AL355672.1, SLC27A6",15742,6.8902,0.010257,6.3529,0.13907,0.8567665453468299,False,146,,,241,5583.0
t2d_xue2018,T2D,metabolic / body-mediated,Cluster110,110,DLCT6b_110,Deep-layer corticothalamic and 6b,NEUR,VGLUT1,"Cerebral cortex: 84.7%, Basal forebrain: 6.3%, Amygdala: 5.0%","Human FI: 9.6%, Human ACC: 9.2%, Human A38: 7.1%","AC105021.1, TRIM22, SULF1, C5AR2, AC073968.2, LGR6, CAV1, AC079380.1, S100Z, ABCC9",15742,5.5955,0.0098973,5.1865,0.14034,0.8528185278072034,False,147,,,110,8324.0
t2d_xue2018,T2D,metabolic / body-mediated,Cluster254,254,MGE_254,MGE interneuron,NEUR,GABA VGLUT3,"Cerebral cortex: 77.9%, Hippocampus: 13.0%, Amygdala: 4.5%","Human M1C: 8.3%, Human MTG: 6.2%, Human MEC: 4.6%","LINC01035, KLHL14, AL450345.2, ITGA1, PAWR, FBN2, AL590608.1, AC022133.2, SLC17A8, SST",15742,5.2453,0.01002,4.9459,0.14446,0.8402523894757271,False,148,,,254,7539.0
t2d_xue2018,T2D,metabolic / body-mediated,Cluster301,301,CBI_301,Cerebellar inhibitory,NEUR,GLY,"Pons: 92.6%, Medulla: 6.6%, Cerebral cortex: 0.7%","Human PnEN: 37.5%, Human PnAN: 26.5%, Human DTg: 16.9%","SLC6A5, TFAP2B, AC104574.2, PAX2, TFAP2A, BHLHE22, AC090796.1, XDH, AC018618.1, LBX1-AS1",15742,4.1642,0.0095612,3.9268,0.14448,0.8401922670305695,False,149,,,301,136.0
t2d_xue2018,T2D,metabolic / body-mediated,Cluster118,118,L5ET_118,Miscellaneous,NEUR,VGLUT1,"Hippocampus: 60.6%, Cerebral cortex: 26.6%, Midbrain: 11.9%","Human Sub: 36.7%, Human TH-TL: 23.9%, Human SC: 11.9%","CSN1S1, ERG, AC005482.1, ATP6V1C2, SLC5A7, LINC02433, LINC00607, ABCB11, POU3F1, EHF",15742,4.6834,0.0093024,4.4401,0.14577,0.8363318462173313,False,150,,,118,109.0
t2d_xue2018,T2D,metabolic / body-mediated,Cluster288,288,CGE_288,CGE interneuron,NEUR,GABA,"Cerebral cortex: 70.6%, Amygdala: 13.7%, Hippocampus: 6.3%","Human M1C: 7.3%, Human MTG: 5.0%, Human MEC: 4.7%","HAPLN1, AC137770.1, LINC00298, AC132803.1, KIT, PKP2, EYA4, ROR2, NXPH2, GRPR",15742,7.2028,0.010168,6.8387,0.14613,0.8352606157085676,False,151,,,288,24831.0
t2d_xue2018,T2D,metabolic / body-mediated,Cluster185,185,CA13_185,Hippocampal CA1-3,NEUR,VGLUT1,"Hippocampus: 100.0%, Cerebral cortex: 0.0%, Amygdala: 0.0%","Human CA1C-CA3C: 43.0%, Human Sub: 38.9%, Human CA1-2R: 13.0%","NTS, FNDC1, AC116345.1, LINC02153, AC023781.1, ESRRAP2, GNA14-AS1, AC092661.1, C16orf74, AL356417.2",15742,5.6851,0.0098478,5.4539,0.14863,0.8278935222075039,False,152,,,185,561.0
t2d_xue2018,T2D,metabolic / body-mediated,Cluster351,351,Splat_351,Splatter,NEUR,GABA,"Midbrain: 90.0%, Thalamus: 8.2%, Hypothalamus: 1.3%","Human SN-RN: 27.9%, Human PAG: 19.7%, Human PTR: 13.1%","LINC00261, FOXA2, TM4SF18, NDNF, PAX5, LINC01956, EMX2OS, ASAH2, EBF3, EMX2",15742,5.3349,0.0095856,5.1591,0.15056,0.8222903939168184,False,153,,,351,559.0
t2d_xue2018,T2D,metabolic / body-mediated,Cluster31,31,Fbl_31,Fibroblast,CHRP,,"Basal forebrain: 47.3%, Medulla: 20.3%, Hypothalamus: 12.4%","Human SEP: 47.2%, Human MN: 11.8%, Human MoAN: 8.8%","PTGDR, BNC2, BMP5, FOXC1, COL3A1, COL1A2, SLPI, SFRP2, SPTLC3, TBX15",15742,1.4902,0.0094049,1.4501,0.15207,0.8179564540569357,False,154,,,31,659.0
t2d_xue2018,T2D,metabolic / body-mediated,Cluster405,405,Amex_405,Amygdala excitatory,NEUR,VGLUT1 VGLUT2,"Cerebral cortex: 41.9%, Hypothalamus: 27.8%, Amygdala: 27.3%","Human AON: 31.1%, Human HTHso: 26.6%, Human CoA: 12.2%","ROR2, TACR3, AC022523.1, AC020704.1, WDR86, AC025470.2, AL136119.1, NFIA-AS2, RXFP2, AC087516.2",15742,7.8463,0.0094535,7.6842,0.15362,0.8135522392250827,False,155,,,405,6125.0
t2d_xue2018,T2D,metabolic / body-mediated,Cluster306,306,CBI_306,Cerebellar inhibitory,,GABA,"Cerebellum: 91.6%, Pons: 3.4%, Medulla: 3.3%","Human CBV: 84.2%, Human CBL: 7.2%, Human PnEN: 1.5%","SCGN, TFAP2B, LIPG, LMCD1, LRRC38, BHLHE22, TFAP2A, LBX1-AS1, EN2, CHRNA3",15742,4.3431,0.0092614,4.2652,0.15429,0.8116622209592474,False,156,,,306,6586.0
t2d_xue2018,T2D,metabolic / body-mediated,Cluster59,59,Astro_59,Astrocyte,ASTRO,,"Pons: 36.2%, Cerebellum: 36.1%, Medulla: 10.9%","Human CbDN: 36.1%, Human PnEN: 13.6%, Human PnRF: 13.0%","LGR6, SDC4, ITPRID1, FGFR3, SLC14A1, SLC7A10, AC090809.1, GJB6, GFAP, PYGM",15742,2.2953,0.0095353,2.2639,0.15533,0.8087446577537348,False,157,,,59,4062.0
t2d_xue2018,T2D,metabolic / body-mediated,Cluster53,53,Astro_53,Astrocyte,ASTRO,,"Hippocampus: 96.3%, Cerebral cortex: 1.5%, Basal forebrain: 1.3%","Human CA4C-DGC: 23.9%, Human DGR-CA4Rpy: 18.3%, Human CA1: 18.1%","LINC00499, GLI3, OAF, ETNPPL, PRDM16-DT, CD38, AC097518.2, FGFR3, OBI1-AS1, AL137139.2",15742,2.7248,0.0095055,2.6964,0.15613,0.8065136402902572,False,158,,,53,4803.0
t2d_xue2018,T2D,metabolic / body-mediated,Cluster147,147,DLIT_147,Deep-layer intratelencephalic,NEUR,VGLUT1,"Cerebral cortex: 65.1%, Amygdala: 19.4%, Basal forebrain: 11.8%","Human Cla: 9.4%, Human FI: 6.8%, Human Idg: 5.9%","CCN4, TMEM233, AP000331.1, THEMIS, AC079163.2, RXFP2, VIT, AC011754.1, SH2D1B, PXDN",15742,7.129,0.0091113,7.2001,0.16107,0.7929853413170997,False,159,,,147,13265.0
t2d_xue2018,T2D,metabolic / body-mediated,Cluster349,349,Splat_349,Splatter,NEUR,GLY,"Medulla: 84.7%, Spinal cord: 12.7%, Pons: 1.7%","Human MoRF-MoEN: 42.5%, Human MoAN: 28.5%, Human MoSR: 13.7%","SLC6A5, PAX2, HOXB3, HOXD3, PAX8, LINC00540, HOXB2, HOXA3, MAB21L2, GBX2",15742,5.2298,0.010105,5.2971,0.16176,0.7911288617530742,False,160,,,349,1557.0
t2d_xue2018,T2D,metabolic / body-mediated,Cluster378,378,Splat_378,Splatter,NEUR,HDC VGLUT2,"Amygdala: 29.4%, Basal forebrain: 25.2%, Hypothalamus: 22.3%","Human BNST: 27.8%, Human ANC: 18.1%, Human SEP: 16.8%","ONECUT3, C14orf39, ONECUT1, MIR217HG, ISL1, VWA5B1, AC022433.1, AC092957.1, COL15A1, AC010478.1",15742,5.5095,0.0090957,5.6507,0.16479,0.7830691462589787,False,161,,,378,493.0
t2d_xue2018,T2D,metabolic / body-mediated,Cluster43,43,COP_43,Committed oligodendrocyte precursor,OLIGO,,"Thalamus: 36.2%, Hypothalamus: 18.0%, Amygdala: 10.3%","Human VLN: 24.5%, Human HTHso: 11.5%, Human La: 6.0%","SLC5A11, FA2H, AL033523.1, CD22, AC012494.1, MOBP, MYRF, SH3TC2-DT, PRR5L, CNDP1",15742,2.9044,0.0088174,2.9821,0.16505,0.7823844713336696,False,162,,,43,417.0
t2d_xue2018,T2D,metabolic / body-mediated,Cluster421,421,Splat_421,Splatter,NEUR,GABA,"Hypothalamus: 64.1%, Amygdala: 19.7%, Thalamus: 14.8%","Human HTHpo: 29.3%, Human HTHso-HTHtub: 19.3%, Human BNST: 16.3%","ECEL1, FAM9B, TMEM114, ARHGAP36, AL035425.2, PGR, DGKK, ESR1, DIRAS3, PGR-AS1",15742,5.5175,0.008819,5.791,0.17036,0.7686323685982888,False,163,,,421,1417.0
t2d_xue2018,T2D,metabolic / body-mediated,Cluster94,94,DLNP_94,Deep-layer near-projecting,NEUR,VGLUT1,"Cerebral cortex: 94.1%, Hippocampus: 2.6%, Amygdala: 2.0%","Human MTG: 18.0%, Human TF: 6.6%, Human V2: 6.2%","IFNG-AS1, CD200R1L, LINC02218, NPSR1-AS1, LINC02042, CCDC80, IL26, BARX2, CD200R1L-AS1, ERG",15742,5.6507,0.0087952,5.9582,0.17147,0.7658118521467979,False,164,,,94,2547.0
t2d_xue2018,T2D,metabolic / body-mediated,Cluster42,42,COP_42,Committed oligodendrocyte precursor,OLIGO,,"Thalamus: 92.7%, Midbrain: 2.3%, Pons: 1.5%","Human VLN: 69.8%, Human ANC: 6.2%, Human LG: 5.0%","CNDP1, LINC01608, GREM1, OPALIN, FA2H, AC110285.1, MYRF, CD22, LINC01792, LINC00906",15742,3.4682,0.0085055,3.7305,0.17627,0.7538215954891372,False,165,,,42,1170.0
t2d_xue2018,T2D,metabolic / body-mediated,Cluster188,188,CA13_188,Hippocampal CA1-3,NEUR,VGLUT1,"Hippocampus: 98.4%, Cerebral cortex: 1.2%, Amygdala: 0.3%","Human CA1U-CA2U-CA3U: 31.4%, Human Sub: 31.1%, Human CA1: 29.6%","NTS, AC023781.1, CTXND1, AC004160.1, LINC02153, AC010230.1, FNDC1, ABCA13, COL24A1, AC092661.1",15742,5.6402,0.0089469,6.1066,0.17785,0.7499461304782008,False,166,,,188,1458.0
t2d_xue2018,T2D,metabolic / body-mediated,Cluster424,424,Splat_424,Splatter,NEUR,GABA,"Amygdala: 34.9%, Hypothalamus: 32.8%, Thalamus: 29.6%","Human ANC: 29.4%, Human BNST: 16.9%, Human HTHpo-HTHso: 15.5%","CYP19A1, CALCR, ARHGAP36, DGKK, GABRE, SCN5A, GABRQ, TMEM255A, LHX6, RADX",15742,7.1403,0.0082896,7.8268,0.18082,0.7427535350926286,False,167,,,424,2384.0
t2d_xue2018,T2D,metabolic / body-mediated,Cluster450,450,Thex_450,Thalamic excitatory,,VGLUT2,"Thalamus: 99.9%, Basal forebrain: 0.0%, Hypothalamus: 0.0%","Human MD: 45.8%, Human ANC: 20.8%, Human ETH: 14.5%","CASQ2, RGS16, AC016766.1, SHOX2, GDNF, TGFBR2, FAM20A, VANGL1, IRAG1, LINC00868",15742,3.9558,0.0085004,4.3458,0.18136,0.7414584928815391,False,168,,,450,3092.0
t2d_xue2018,T2D,metabolic / body-mediated,Cluster237,237,Splat_237,Splatter,NEUR,GABA,"Amygdala: 57.4%, Cerebral cortex: 20.2%, Basal forebrain: 8.4%","Human BL: 16.0%, Human CMN: 13.9%, Human CEN: 8.6%","FBN2, LHX6, PDGFD, SNTG2, SOX6, CDCA7, AKR1C8P, AC022905.1, IGFBP4, AP002989.1",15742,6.5922,0.0083916,7.2672,0.18218,0.7394993022609117,False,169,,,237,2234.0
t2d_xue2018,T2D,metabolic / body-mediated,Cluster129,129,ULIT_129,Upper-layer intratelencephalic,NEUR,VGLUT1 VGLUT2,"Cerebral cortex: 99.1%, Hippocampus: 0.4%, Basal forebrain: 0.4%","Human MTG: 14.4%, Human A44-A45: 8.5%, Human A46: 6.7%","LINC02296, LINC00326, AC110014.1, AC016598.2, AJ009632.2, LINC01478, AC016598.1, AC008696.2, LINC00508, LINC00507",15742,6.0844,0.0085628,6.7468,0.18358,0.7361746344787856,False,170,,,129,46343.0
t2d_xue2018,T2D,metabolic / body-mediated,Cluster97,97,DLCT6b_97,Deep-layer corticothalamic and 6b,NEUR,VGLUT1,"Cerebral cortex: 54.4%, Hippocampus: 42.5%, Amygdala: 2.1%","Human MEC: 52.6%, Human CA1: 22.6%, Human CA1U-CA2U-CA3U: 13.9%","LINC01194, GUCA1C, AC046195.2, AC023503.1, LINC02067, SLC15A5, ERG, AC092131.1, SCUBE1, IGFBP3",15742,3.6667,0.0082049,4.0945,0.18526,0.7322183402846408,False,171,,,97,287.0
t2d_xue2018,T2D,metabolic / body-mediated,Cluster45,45,Oligo_45,Oligodendrocyte,OLIGO,,"Cerebral cortex: 20.0%, Basal forebrain: 18.5%, Midbrain: 15.8%","Human GPe: 8.4%, Human SN: 7.4%, Human SN-RN: 4.8%","LINC01608, OPALIN, LINC01792, SLCO1A2, LINC02882, FOLH1, MAL, ASPA, AC108721.2, SH3TC2",15742,2.4035,0.0081932,2.6933,0.18609,0.7302769641153711,False,172,,,45,109325.0
t2d_xue2018,T2D,metabolic / body-mediated,Cluster371,371,Splat_371,Splatter,NEUR,VGLUT2,"Midbrain: 99.7%, Cerebellum: 0.3%, Cerebral cortex: 0.0%","Human SC: 93.5%, Human IC: 6.0%, Human PAG-DR: 0.3%","CPA6, BNC2, NPSR1, EBF2, PGM5, OTOS, SHISAL2B, EBF1, LEF1, TAGLN2",15742,4.2619,0.0081939,4.828,0.18869,0.7242511155208051,False,173,,,371,398.0
t2d_xue2018,T2D,metabolic / body-mediated,Cluster61,61,Astro_61,Astrocyte,ASTRO,,"Hippocampus: 47.7%, Cerebral cortex: 21.1%, Basal forebrain: 19.2%","Human CA1: 14.3%, Human Cla: 8.9%, Human CA4C-DGC: 6.7%","AC012405.1, TNC, GFAP, ID3, AC073941.1, AL627316.1, AQP4, CD38, CD44, ANGPTL4",15742,2.2756,0.0082034,2.5796,0.18885,0.7238830108364562,False,174,,,61,13621.0
t2d_xue2018,T2D,metabolic / body-mediated,Cluster429,429,Splat_429,Splatter,NEUR,GABA,"Basal forebrain: 55.9%, Amygdala: 24.1%, Thalamus: 12.9%","Human SEP: 48.3%, Human BNST: 23.8%, Human ANC: 12.9%","PRDM16, FREM2, TTR, PRDM16-DT, AC092957.1, ZIC2, SCN5A, Z96074.1, C14orf39, ZIC5",15742,5.4665,0.008299,6.2055,0.18919,0.7231018227946613,False,175,,,429,9792.0
t2d_xue2018,T2D,metabolic / body-mediated,Cluster93,93,DLNP_93,Deep-layer near-projecting,NEUR,VGLUT1,"Cerebral cortex: 97.2%, Basal forebrain: 1.1%, Hypothalamus: 0.7%","Human M1C: 28.5%, Human A23: 15.2%, Human A29-A30: 9.3%","IFNG-AS1, NPSR1-AS1, ERG, CD200R1L, LINC02218, BARX2, CCDC80, IL26, LINC02042, ROBO3",15742,5.3741,0.0082637,6.1536,0.19125,0.7183985561743448,False,176,,,93,2217.0
t2d_xue2018,T2D,metabolic / body-mediated,Cluster347,347,Splat_347,Splatter,NEUR,GLY,"Medulla: 68.6%, Spinal cord: 29.3%, Pons: 0.9%","Human MoAN: 33.4%, Human SpC: 29.3%, Human MoSR: 21.6%","PAX2, HOXB3, EBF3, NPPC, SLC6A5, HOXB7, AC024230.1, HOXB-AS3, PAX8, PDYN",15742,4.2591,0.0086126,4.9516,0.19486,0.7102773017862021,False,177,,,347,2434.0
t2d_xue2018,T2D,metabolic / body-mediated,Cluster30,30,Fbl_30,Fibroblast,CHRP,,"Cerebral cortex: 35.3%, Basal forebrain: 29.7%, Medulla: 10.6%","Human SEP: 29.0%, Human A35r: 21.2%, Human MN: 6.4%","CFH, SLC6A20, COL1A2, KDR, VIM, SLC5A5, COL3A1, SLC6A13, SLC16A12, SLC6A12",15742,1.6744,0.0078951,1.9479,0.19501,0.7099431176966344,False,178,,,30,283.0
t2d_xue2018,T2D,metabolic / body-mediated,Cluster195,195,CA4_195,Hippocampal CA4,NEUR,VGLUT1,"Hippocampus: 99.4%, Thalamus: 0.5%, Cerebral cortex: 0.1%","Human CA4C-DGC: 87.2%, Human CA3R: 4.8%, Human CA1C-CA3C: 4.7%","SCGN, MORC1, ITGA4, AC127526.2, ABCA13, AC127526.1, LINC02237, AL450311.1, AC021594.2, CASC6",15742,4.127,0.008183,4.8023,0.19508,0.7097872530804713,False,179,,,195,2159.0
t2d_xue2018,T2D,metabolic / body-mediated,Cluster418,418,Splat_418,Splatter,NEUR,HDC VGLUT2,"Hypothalamus: 99.3%, Midbrain: 0.5%, Thalamus: 0.1%","Human HTHso-HTHtub: 52.0%, Human HTHtub: 32.9%, Human HTHma-HTHtub: 10.3%","FEZF1, FEZF1-AS1, PGR, LINC00540, DGKK, ZCCHC12, PRLR, PGR-AS1, SYTL4, ANKRD34B",15742,3.6963,0.0075934,4.3109,0.19562,0.7085867454297853,False,180,,,418,5390.0
t2d_xue2018,T2D,metabolic / body-mediated,Cluster441,441,Midi_441,Midbrain-derived inhibitory,NEUR,GABA,"Thalamus: 89.9%, Midbrain: 8.8%, Pons: 0.7%","Human Pul: 15.3%, Human MD: 13.6%, Human ETH: 13.0%","DMBX1, OTX2-AS1, AC008163.1, AL161757.4, OTX2, TSPAN12, AL137100.3, LINC01210, CASR, MYO3B",15742,5.1216,0.0081565,6.0487,0.19858,0.7020644936403526,False,181,,,441,22931.0
t2d_xue2018,T2D,metabolic / body-mediated,Cluster398,398,Splat_398,Splatter,NEUR,VGLUT2,"Medulla: 86.6%, Pons: 12.8%, Midbrain: 0.2%","Human MoRF-MoEN: 40.5%, Human MoAN: 37.3%, Human MoSR: 8.9%","PHOX2B-AS1, PHOX2B, LINC00682, HOXB3, SLC5A7, SLC6A2, GAL, TH, PHOX2A, HOTAIRM1",15742,3.3325,0.0079681,3.9375,0.19869,0.7018239902334494,False,182,,,398,2093.0
t2d_xue2018,T2D,metabolic / body-mediated,Cluster410,410,Splat_410,Splatter,NEUR,VGLUT2,"Hypothalamus: 82.0%, Thalamus: 11.6%, Amygdala: 5.2%","Human HTHpo-HTHso: 58.9%, Human HTHtub: 15.3%, Human ANC: 11.5%","AVP, OXT, HCRT, SIM1, OTP, TRH, CARTPT, TH, AC092675.1, PGF",15742,3.3241,0.0076174,3.9359,0.19919,0.700732468391398,False,183,,,410,2511.0
t2d_xue2018,T2D,metabolic / body-mediated,Cluster261,261,MGE_261,MGE interneuron,NEUR,GABA,"Cerebral cortex: 95.5%, Hippocampus: 1.4%, Basal forebrain: 1.4%","Human M1C: 13.2%, Human MTG: 6.5%, Human A29-A30: 4.8%","TCIM, RNF144B, LRRC38, ADAMTS17, PRDM1, KCNS3, MYO5B, RGS5, OSTN, LHX6",15742,5.6037,0.0079336,6.6495,0.1997,0.6996219351292975,False,184,,,261,21457.0
t2d_xue2018,T2D,metabolic / body-mediated,Cluster365,365,Splat_365,Splatter,NEUR,GABA VGLUT2,"Pons: 43.0%, Midbrain: 30.2%, Medulla: 17.1%","Human DTg: 13.8%, Human PnEN: 12.8%, Human MoRF-MoEN: 11.6%","SLC6A5, GLRA1, ONECUT1, LHX5-AS1, MAB21L2, LHX1, LINC01933, ASAH2, KLHL1, IGDCC4",15742,5.6145,0.0075716,6.8378,0.2058,0.6865546295735858,False,185,,,365,28081.0
t2d_xue2018,T2D,metabolic / body-mediated,Cluster430,430,MSN_430,Medium spiny neuron,NEUR,GABA,"Amygdala: 87.9%, Hypothalamus: 6.5%, Thalamus: 3.4%","Human CEN: 41.5%, Human BM: 23.7%, Human BNST: 19.7%","FREM2, IQGAP2, P2RY1, PENK, TRHR, GABRG1, ANKRD34B, TMEM215, LINC01305, FREM2-AS1",15742,4.6834,0.0075889,5.8792,0.21285,0.6719263454868447,False,186,,,430,2057.0
t2d_xue2018,T2D,metabolic / body-mediated,Cluster157,157,Amex_157,Amygdala excitatory,NEUR,VGLUT1 VGLUT2,"Amygdala: 65.8%, Cerebral cortex: 28.7%, Hippocampus: 5.5%","Human BL: 31.3%, Human BM: 23.4%, Human Pir: 14.2%","TG, CERS3-AS1, AC099565.1, CAPN8, AL136441.1, SLA, MOXD1, DSP, AL136985.3, SEMA3D",15742,4.0506,0.0075125,5.1129,0.21412,0.669342765288606,False,187,,,157,14855.0
t2d_xue2018,T2D,metabolic / body-mediated,Cluster259,259,MGE_259,MGE interneuron,NEUR,GABA,"Cerebral cortex: 89.3%, Amygdala: 3.4%, Hippocampus: 3.3%","Human MTG: 6.4%, Human M1C: 6.3%, Human A43: 4.0%","RGS5, AC022905.1, MYO5B, AL136114.1, TCIM, KCNS3, AC011586.2, MAFB, LHX6, CRHBP",15742,5.714,0.0075625,7.2328,0.21477,0.6680263828625036,False,188,,,259,17841.0
t2d_xue2018,T2D,metabolic / body-mediated,Cluster51,51,Bgl_51,Bergmann glia,ASTRO,,"Cerebellum: 95.8%, Pons: 1.9%, Medulla: 1.9%","Human CBV: 82.3%, Human CBL: 13.3%, Human MoAN: 1.3%","LINC01727, PAX3, AL627316.1, LCAT, AL355306.2, LINC01726, SMTN, AC098656.1, LGR6, AL449403.3",15742,1.6209,0.0074053,2.1027,0.2204,0.6567884098202526,False,189,,,51,8041.0
t2d_xue2018,T2D,metabolic / body-mediated,Cluster148,148,DLIT_148,Deep-layer intratelencephalic,NEUR,VGLUT1,"Cerebral cortex: 85.2%, Basal forebrain: 6.0%, Amygdala: 5.0%","Human MTG: 7.7%, Human ACC: 7.4%, Human FI: 6.6%","LINC00343, AC011754.1, THEMIS, TMEM233, AL356432.3, AC092131.1, AC079163.2, AC004917.1, AC015943.1, SH2D1B",15742,5.2808,0.0071777,6.8703,0.22106,0.6554898343134677,False,190,,,148,16196.0
t2d_xue2018,T2D,metabolic / body-mediated,Cluster47,47,Oligo_47,Oligodendrocyte,OLIGO,,"Thalamus: 24.9%, Cerebral cortex: 20.9%, Hippocampus: 13.8%","Human GPe: 5.4%, Human STH: 4.8%, Human MTG: 4.2%","OPALIN, LINC01608, CD9, LINC01792, RNASE1, CNDP1, AC110285.1, PLLP, NKX6-2, MAG",15742,2.1573,0.0070524,2.8098,0.22132,0.6549793384578851,False,191,,,47,124837.0
t2d_xue2018,T2D,metabolic / body-mediated,Cluster88,88,DLNP_88,Deep-layer near-projecting,NEUR,VGLUT1,"Cerebral cortex: 92.2%, Basal forebrain: 4.8%, Amygdala: 1.9%","Human MTG: 15.3%, Human Idg: 10.9%, Human FI: 7.9%","IFNG-AS1, LINC02218, NPSR1-AS1, NPSR1, CD200R1L, AC244502.1, AC005909.2, IL26, CD36, CDCP1",15742,4.4103,0.0071453,5.7528,0.22166,0.6543126711011527,False,192,,,88,1548.0
t2d_xue2018,T2D,metabolic / body-mediated,Cluster112,112,DLCT6b_112,Deep-layer corticothalamic and 6b,NEUR,VGLUT1,"Cerebral cortex: 65.2%, Hippocampus: 33.8%, Amygdala: 0.6%","Human MEC: 57.0%, Human Sub: 17.6%, Human CA1U-CA2U-CA3U: 9.7%","AC092131.1, LINC01720, AC004917.1, RXFP2, CCN4, AL137191.1, CPZ, AC073968.2, AL596257.1, ADAMTSL1",15742,4.8095,0.0073095,6.2927,0.22235,0.6529628662150466,False,193,,,112,6334.0
t2d_xue2018,T2D,metabolic / body-mediated,Cluster291,291,CGE_291,CGE interneuron,NEUR,GABA,"Cerebral cortex: 75.1%, Hippocampus: 14.3%, Amygdala: 7.1%","Human MTG: 6.3%, Human M1C: 5.2%, Human MEC: 4.6%","Z83818.2, NPR3, KMO, AL391832.4, AL136114.1, EDNRA, SLC10A4, AC013265.1, PCDH18, TMEM100",15742,4.9572,0.0070913,6.5034,0.22296,0.6517730442947522,False,194,,,291,12240.0
t2d_xue2018,T2D,metabolic / body-mediated,Cluster79,79,Chrp_79,Choroid plexus,CHRP,,"Basal forebrain: 94.0%, Medulla: 5.0%, Hippocampus: 0.5%","Human SEP: 94.0%, Human MoAN: 2.9%, Human MoSR: 1.6%","AC004052.1, TRPV4, AC016152.1, LINC00880, CLIC6, ABCA4, SLC5A5, NWD1, AP003500.1, LMX1A",15742,1.5565,0.0069136,2.0547,0.22438,0.6490158563139724,False,195,,,79,383.0
t2d_xue2018,T2D,metabolic / body-mediated,Cluster281,281,CGE_281,CGE interneuron,NEUR,GABA,"Cerebral cortex: 70.5%, Amygdala: 13.0%, Hippocampus: 10.6%","Human Pir: 5.7%, Human MEC: 4.6%, Human M1C: 4.5%","HTR3A, AC004862.1, AL139090.1, HGFAC, AL391832.4, CHRNA6, EDNRA, AC006305.1, CHRNB3, TNFAIP8L3",15742,3.7528,0.0069847,5.0309,0.22786,0.6423319069563662,False,196,,,281,2234.0
t2d_xue2018,T2D,metabolic / body-mediated,Cluster274,274,LLC_274,LAMP5-LHX6 and Chandelier,NEUR,GABA,"Cerebral cortex: 84.6%, Basal forebrain: 5.9%, Hippocampus: 3.1%","Human M1C: 11.7%, Human MTG: 7.6%, Human Cla: 4.8%","LINC01344, AC137770.1, SFRP1, AC132803.1, HAPLN1, EYA4, PDGFD, ANO1, AP002989.1, LINC00298",15742,4.8217,0.0071063,6.4901,0.22877,0.6406009278191134,False,197,,,274,6373.0
t2d_xue2018,T2D,metabolic / body-mediated,Cluster376,376,Splat_376,Splatter,NEUR,VGLUT2,"Hypothalamus: 51.0%, Midbrain: 37.9%, Thalamus: 6.6%","Human SN-RN: 18.1%, Human HTHma: 17.5%, Human HTHso-HTHtub: 14.7%","TRH, LMX1A, SIM1, OTP, MIR217HG, FEZF1-AS1, ONECUT1, DLK1, PITX2, ONECUT3",15742,4.5848,0.00685,6.1869,0.22934,0.639520191828058,False,198,,,376,2573.0
t2d_xue2018,T2D,metabolic / body-mediated,Cluster416,416,Splat_416,Splatter,NEUR,GABA,"Hypothalamus: 65.4%, Thalamus: 17.9%, Amygdala: 8.1%","Human HTHso-HTHtub: 19.1%, Human ANC: 17.7%, Human HTHpo: 16.0%","GAL, HMX3, ECEL1, ISL1, ARHGAP36, DLK1, HMX2, DIRAS3, AC010478.1, C14orf39",15742,3.8205,0.0068778,5.1595,0.22951,0.639198387032148,False,199,,,416,3344.0
t2d_xue2018,T2D,metabolic / body-mediated,Cluster22,22,Per_22,Vascular,PER,,"Thalamus: 34.2%, Cerebral cortex: 15.9%, Basal forebrain: 10.2%","Human CBV: 6.7%, Human CM: 5.4%, Human LP: 5.3%","CARMN, NOTCH3, SLC6A12, ITIH5, GGT5, SLC12A7, IFITM2, LINC02147, CYSLTR2, BGN",15742,1.2221,0.0067735,1.6614,0.231,0.6363880201078557,False,200,,,22,1856.0
t2d_xue2018,T2D,metabolic / body-mediated,Cluster375,375,Splat_375,Splatter,NEUR,VGLUT2 VGLUT3,"Thalamus: 94.3%, Midbrain: 5.4%, Pons: 0.1%","Human ETH: 77.2%, Human MD-Re: 14.9%, Human PAG-DR: 3.3%","GPR151, POU4F1, MMRN1, DLK1, LHX9, LRRC55, LINC01497, EBF1, LINC01876, ONECUT1",15742,3.6707,0.0067549,5.0043,0.23163,0.6352051928258902,False,201,,,375,2762.0
t2d_xue2018,T2D,metabolic / body-mediated,Cluster44,44,Oligo_44,Oligodendrocyte,OLIGO,,"Thalamus: 20.9%, Pons: 19.2%, Midbrain: 19.1%","Human SN: 10.9%, Human PnRF: 6.9%, Human CbDN: 5.8%","AC004690.2, SLC5A11, ITGA2, AL033523.1, LINC02882, MOG, FOLH1, CARNS1, LINC01949, LRP2",15742,1.9725,0.0067113,2.693,0.23195,0.6346056231452216,False,202,,,44,101039.0
t2d_xue2018,T2D,metabolic / body-mediated,Cluster299,299,CBI_299,Cerebellar inhibitory,NEUR,GLY,"Cerebellum: 71.1%, Pons: 20.4%, Midbrain: 4.5%","Human CbDN: 64.6%, Human PnEN: 7.1%, Human PB: 6.6%","SLC6A5, PAX2, TFAP2B, IGF2BP2, TFAP2A, GBA3, INHBA, LIPG, ANGPT1, BHLHE22",15742,3.429,0.006694,4.6999,0.23283,0.6329610618441317,False,203,,,299,560.0
t2d_xue2018,T2D,metabolic / body-mediated,Cluster396,396,Splat_396,Splatter,NEUR,VGLUT3,"Pons: 66.2%, Midbrain: 31.2%, Hypothalamus: 1.2%","Human DTg: 32.0%, Human PnEN: 26.2%, Human PAG: 17.4%","LMX1B, FEV, TPH2, SLC17A8, RLN3, GATA3, LINC01956, SLC6A4, GATA2, VWA5B1",15742,3.8704,0.006792,5.3433,0.23443,0.6299868124458763,False,204,,,396,1608.0
t2d_xue2018,T2D,metabolic / body-mediated,Cluster423,423,Splat_423,Splatter,NEUR,GABA,"Amygdala: 50.6%, Thalamus: 19.8%, Hypothalamus: 15.4%","Human ANC: 19.2%, Human CEN: 17.4%, Human CMN: 13.8%","CYP19A1, SCN5A, DGKK, GABRQ, ARHGAP36, DIRAS3, NTS, FBXL21P, AL035425.2, VWA5B1",15742,5.8054,0.0064702,8.2978,0.24209,0.6160231495690672,False,205,,,423,3114.0
